kategoria,nazwa,adres,teryt_gmina
szkola,ZESPÓŁ SZKÓŁ SPECJALNYCH W KOLBUSZOWEJ DOLNEJ,"Wiejska 90, 36-100 Kolbuszowa Dolna",1806025
szkola,ZESPÓŁ SZKÓŁ NR 1 W OPATOWIE,"Juliusza Słowackiego 56, 27-500 Opatów",2606044
szkola,ZESPÓŁ SZKÓŁ ELEKTRONICZNYCH IM. I. DOMEYKI W BOLESŁAWCU,"Heleny i Wincentego Tyrankiewiczów 2, 59-700 Bolesławiec",0201011
szkola,ZESPÓŁ PRZEDSZKOLI W NOWYM SĄCZU,"Ignacego Paderewskiego 19, 33-300 Nowy Sącz",1262011
szkola,ZESPÓŁ SZKÓŁ MECHANICZNO-ELEKTRYCZNYCH W INOWROCŁAWIU,"Dworcowa 25, 88-100 Inowrocław",0407011
szkola,ZESPÓŁ SZKÓŁ BUDOWLANYCH IM. GENERAŁA WŁADYSŁAWA SIKORSKIEGO W INOWROCŁAWIU,"Prezydenta Gabriela Narutowicza 34, 88-100 Inowrocław",0407011
szkola,ZESPÓŁ SZKÓŁ OGÓLNOKSZTAŁCĄCYCH I TECHNICZNYCH IM. JANA PAWŁA II W LIPSKU,"Zwoleńska 12, 27-300 Lipsko",1409034
szkola,ZESPÓŁ SZKOLNO-PRZEDSZKOLNY W CZARNOCINIE,"Główna 134, 97-318 Czarnocin",1010022
szkola,ZESPÓŁ SZKÓŁ NR 1 W PIEKARACH ŚLĄSKICH,"Marii Curie-Skłodowskiej 49, 41-949 Piekary Śląskie",2471011
szkola,ZESPÓŁ PLACÓWEK OŚWIATOWYCH - PUBLICZNA SZKOŁA PODSTAWOWA IM. TADEUSZA KOŚCIUSZKI I PRZEDSZKOLE W KONIEMŁOTACH,"Staszowska 7, 28-200 Koniemłoty",2612075
szkola,ZESPÓŁ SZKÓŁ IM. IGNACEGO JANA PADEREWSKIEGO W KNUROWIE,"1 Maja 21, 44-190 Knurów",2405011
szkola,ZESPÓŁ SZKÓŁ IM.MARII KONOPNICKIEJ W PYSKOWICACH,"kard. Stefana Wyszyńskiego 37, 44-120 Pyskowice",2405021
szkola,ZESPÓŁ SZKÓŁ SPECJALNYCH Z SIEDZIBĄ W KNUROWIE PRZY UL. SZPITALNEJ 25,"Szpitalna 25, 44-194 Knurów",2405011
szkola,ZESPÓŁ SZKÓŁ ZAWODOWYCH NR 2 W KNUROWIE,"Szpitalna 29, 44-194 Knurów",2405011
szkola,ZESPÓŁ SZKÓŁ SPECJALNYCH Z SIEDZIBĄ W PYSKOWICACH PRZY UL. PONIATOWSKIEGO 2,"Józefa Poniatowskiego 2, 44-120 Pyskowice",2405021
szkola,ZESPÓŁ SZKÓŁ TECHNICZNYCH W PILE,"Ceglana 4, 64-920 Piła",3019011
szkola,ZESPÓŁ SZKÓŁ SPECJALNYCH NR 2,"Karolewska 30/34, 90-561 Łódź-Polesie",1061049
szkola,ZESPÓŁ SZKOLNO - PRZEDSZKOLNY W RĄBINIE,"Rąbino 57, 78-331 Rąbino",3216042
szkola,ZESPÓŁ SZKÓŁ PONADPODSTAWOWYCH W SZCZERCOWIE,"J. Piłsudskiego 66, 97-420 Szczerców",1001072
szkola,ZESPÓŁ SZKÓŁ GASTRONOMICZNYCH W PILE,"gen. Sikorskiego 73, 64-920 Piła",3019011
szkola,ZESPÓŁ SZKÓŁ IM. MARKA KOTAŃSKIEGO,"Solankowa 21, 88-100 Inowrocław",0407011
szkola,ZESPÓŁ EDUKACYJNY NR 2 W ZIELONEJ GÓRZE,"Leopolda Staffa 10, 65-436 Zielona Góra",0862011
szkola,ZESPÓŁ SZKÓŁ SPECJALNYCH NR 1 W ZIELONEJ GÓRZE,"Piastowska 9, 65-515 Zielona Góra",0862011
szkola,ZESPÓŁ SZKÓŁ MISTRZOSTWA SPORTOWEGO W ZIELONEJ GÓRZE,"Stanisława Wyspiańskiego 21, 65-036 Zielona Góra",0862011
szkola,ZESPÓŁ SZKOLNO-PRZEDSZKOLNY W PRZYROWIE,"Szkolna 44, 42-248 Przyrów",2404144
szkola,ZESPÓŁ SZKÓŁ EKOLOGICZNYCH W ZIELONEJ GÓRZE,"Francuska 25a, 65-943 Zielona Góra",0862011
szkola,ZESPÓŁ EDUKACYJNY NR 3 W ZIELONEJ GÓRZE,"Osiedle Pomorskie 13, 65-548 Zielona Góra",0862011
szkola,ZESPÓŁ SZKÓŁ ZAWODOWYCH SPECJALNYCH NR 2,"Al. Pierwszej Dywizji 16/18, 91-836 Łódź-Bałuty",1061029
szkola,ZESPÓŁ SZKÓŁ SPECJALNYCH W TARNOBRZEGU,"Mikołaja Kopernika 18, 39-400 Tarnobrzeg",1864011
szkola,ZESPÓŁ SZKÓŁ TECHNICZNYCH IM. MIKOŁAJA KOPERNIKA W ZIELONEJ GÓRZE,"Wrocławska 65A, 65-218 Zielona Góra",0862011
szkola,ZESPÓŁ SZKOLNO-PRZEDSZKOLNY W OWSISZCZACH,"Szkolna 1, 47-450 Owsiszcze",2411042
szkola,ZESPÓŁ WYCHOWANIA I POMOCY PSYCHOLOGICZNO-PEDAGOGICZNEJ NR 2 W CHEŁMIE,"Powstańców Warszawy 8, 22-100 Chełm",0662011
szkola,ZESPÓŁ SZKÓŁ W OŻAROWIE IM. MARII SKŁODOWSKIEJ-CURIE,"Wzgórze 56, 27-530 Ożarów",2606054
szkola,ZESPÓŁ SZKOLNO-PRZEDSZKOLNY W KRZYŻOWICACH,"Szkolna 7, 43-254 Krzyżowice",2410042
szkola,ZESPÓŁ SZKOLNO-PRZEDSZKOLNY W GOLASOWICACH,"Z. Nałkowskiej 2, 43-252 Golasowice",2410042
szkola,ZESPÓŁ SZKOLNO-PRZEDSZKOLNY W PAWŁOWICZKACH,"Korfantego 3, 47-280 Pawłowiczki",1603042
szkola,ZESPÓŁ SZKOLNO-PRZEDSZKOLNY W STOPNICY,"Kazimierza Wielkiego 23, 23A, 23B, 23D, 28-130 Stopnica",2601064
szkola,MIEJSKI ZESPÓŁ SZKÓŁ NR 1 W KROŚNIE,"Jana i Stanisława Magurów 1, 38-400 Krosno",1861011
szkola,MIEJSKI ZESPÓŁ SZKÓŁ NR 2 W KROŚNIE,"Stanisława Wyspiańskiego 20, 38-400 Krosno",1861011
szkola,ZESPÓŁ SZKOLNO-PRZEDSZKOLNY W OSTROŻNICY,"Kościelna 42, 47-280 Ostrożnica",1603042
szkola,MIEJSKI ZESPÓŁ SZKÓŁ NR 3 W KROŚNIE,"ks. Stanisława Decowskiego 9, 38-400 Krosno",1861011
szkola,ZESPÓŁ PLACÓWEK OŚWIATOWYCH W TRZCIANIE,"Trzciana 403, 32-733 Trzciana",1201082
szkola,ZESPÓŁ SZKOLNO-PRZEDSZKOLNY W GRANOWIE,"Konstytucji 3 Maja 1A, 62-066 Granowo",3005012
szkola,ZESPÓŁ SZKÓŁ TECHNICZNO-EKONOMICZNYCH W SKAWINIE,"Mikołaja Kopernika 13, 32-050 Skawina",1206114
szkola,ZESPÓŁ SZKÓŁ PONADPODSTAWOWYCH W KRZESZOWICACH,"Krakowska 15, 32-065 Krzeszowice",1206064
szkola,ZESPÓŁ SZKÓŁ PONADPODSTAWOWYCH IM.WINCENTEGO WITOSA W GIEBUŁTOWIE,"Szkolne 8, 32-085 Giebułtów",1206152
szkola,ZESPÓŁ SZKÓŁ I PLACÓWEK OŚWIATOWYCH W SKALE,"ks. Stanisława Połetka 30, 32-043 Skała",1206104
szkola,ZESPÓŁ SZKÓŁ ROLNICZE CENTRUM KSZTAŁCENIA USTAWICZNEGO IM. FRANCISZKA STEFCZYKA W CZERNICHOWIE,"Rynek 17, 32-070 Czernichów",1206012
szkola,ZESPÓŁ SZKÓŁ W SOLCU NAD WISŁĄ,"Zygmunta Łoteckiego 24, 27-320 Solec nad Wisłą",1409064
szkola,ZESPÓŁ SZKÓŁ ZAWODOWYCH IM. MARII SKŁODOWSKIEJ-CURIE W PUSTKOWIE-OSIEDLU,"Pustków-Osiedle 34a, 39-206 Pustków-Osiedle",1803042
szkola,ZESPÓŁ SZKÓŁ IM. KS. STANISŁAWA STASZICA,"Mikołaja Kopernika 1, 39-400 Tarnobrzeg",1864011
szkola,ZESPÓŁ SZKÓŁ NR 2 W TARNOBRZEGU,"Stanisława Jachowicza 4, 39-400 Tarnobrzeg",1864011
szkola,ZESPÓŁ SZKÓŁ NR 3 W TARNOBRZEGU,"św. Barbary 1B, 39-400 Tarnobrzeg",1864011
szkola,ZESPÓŁ SZKÓŁ W GOŹDZIE,"Gózd 125, 26-140 Gózd",2610032
szkola,ZESPÓŁ SZKÓŁ IM. HIPOLITA CEGIELSKIEGO W CHODZIEŻY,"Prymasa Stefana Wyszyńskiego 2, 64-800 Chodzież",3001011
szkola,ZESPÓŁ SZKÓŁ TECHNICZNYCH I LICEALNYCH NR 2,"J. Kilińskiego 8c, 05-825 Grodzisk Mazowiecki",1405044
szkola,ZESPÓŁ SZKOLNO - PRZEDSZKOLNY W KOŁACZKOWIE,"Krakowska 1, 62-306 Kołaczkowo",3030012
szkola,ZESPÓŁ SZKÓŁ ZAWODOWYCH NR 1 IM. MJR H. DOBRZAŃSKIEGO „HUBALA” W STARACHOWICACH,"Radomska 72, 27-200 Starachowice",2611011
szkola,ZESPÓŁ PUBLICZNYCH PLACÓWEK OŚWIATOWYCH W SAMBORCU,"Samborzec 79, 27-650 Samborzec",2609072
szkola,ZESPÓŁ PLACÓWEK OŚWIATOWYCH W CHOBRZANACH,"Chobrzany 111, 27-650 Chobrzany",2609072
szkola,ZESPÓŁ PLACÓWEK OŚWIATOWYCH - PUBLICZNA SZKOŁA PODSTAWOWA IM. STEFANA ŻEROMSKIEGO I PRZEDSZKOLE W KUROZWĘKACH,"Szydłowska 9, 28-200 Kurozwęki",2612075
szkola,ZESPÓŁ PLACÓWEK OŚWIATOWYCH W KAZANOWIE,"Konecka 12, 26-200 Nowy Kazanów",2605035
szkola,ZESPÓŁ PLACÓWEK OŚWIATOWYCH W NIEŚWINIU,"Szkolna 6, 26-200 Nieświń",2605035
szkola,ZESPÓŁ PLACÓWEK OŚWIATOWYCH W POMYKOWIE,"Pomyków 25a, 26-200 Pomyków",2605035
szkola,ZESPÓŁ SZKOLNO-PRZEDSZKOLNY W WOLI KIEŁPIŃSKIEJ,"Wola Kiełpińska 1, 05-140 Wola Kiełpińska",1408045
szkola,ZESPÓŁ SZKÓŁ IM. JÓZEFA WYBICKIEGO W RATAJACH,"Chodzieska 9, 64-800 Rataje",3001032
szkola,ZESPÓŁ SZKÓŁ W ŁOBŻENICY,"Złotowska 15, 89-310 Łobżenica",3019044
szkola,ZESPÓŁ SZKÓŁ W IŃSKU,"Poprzeczna 1, 73-140 Ińsko",3214054
szkola,ZESPÓŁ PLACÓWEK OŚWIATOWYCH - PUBLICZNA SZKOŁA PODSTAWOWA NR 1 IM. TADEUSZA KOŚCIUSZKI I PRZEDSZKOLE NR 4 IM. TADEUSZA KOŚCIUSZKI W STASZOWIE,"Wysoka 39, 28-200 Staszów",2612074
szkola,ZESPÓŁ SZKOLNO-PRZEDSZKOLNY W BĘDKOWIE,"Władysława Stanisława Reymonta 11, 97-319 Będków",1016022
szkola,ZESPÓŁ SZKÓŁ PRZY TEATRALNEJ W PILE,"Teatralna 1, 64-920 Piła",3019011
szkola,MIEJSKI ZESPÓŁ SZKÓŁ NR 4 W KROŚNIE,"Stefana Kisielewskiego 18, 38-400 Krosno",1861011
szkola,ZESPÓŁ SZKÓŁ NR 1 IM. JANUSZA KORCZAKA W ŁAŃCUCIE,"Grunwaldzka 11, 37-100 Łańcut",1810011
szkola,ZESPÓŁ SZKÓŁ ARCHITEKTONICZNO-BUDOWLANYCH W KROŚNIE,"ks. Piotra Skargi 3, 38-400 Krosno",1861011
szkola,MIEJSKI ZESPÓŁ SZKÓŁ NR 6 W KROŚNIE,"Kletówki 1, 38-400 Krosno",1861011
szkola,ZESPÓŁ SZKÓŁ ZAWODOWYCH NR 1 IM. J. PSARSKIEGO W OSTROŁĘCE,"11 Listopada 20, 07-410 Ostrołęka",1461011
szkola,ZESPÓŁ SZKOLNO-PRZEDSZKOLNY W OGRODNICZKACH,"Zagórna 7, 16-030 Ogrodniczki",2002095
szkola,KRUSZWICKA SZKOŁA REALNA,"Kujawska 22, 88-150 Kruszwica",0407064
szkola,POWIATOWE CENTRUM PORADNICTWA PSYCHOLOGICZNO-PEDAGOGICZNEGO I DORADZTWA EDUKACYJNEGO W DZIERŻONIOWIE,"Parkowa 2, 58-200 Dzierżoniów",0202021
szkola,ZESPÓŁ JEDNOSTEK EDUKACYJNYCH WOJEWÓDZTWA MAŁOPOLSKIEGO W GORLICACH,"Władysława Jagiełły 2, 38-300 Gorlice",1205011
szkola,PAŃSTWOWA SZKOŁA MUZYCZNA I I II ST. W ŻAGANIU,"Żelazna 1, 68-100 Żagań",0810021
szkola,ZESPÓŁ SZKÓŁ W PRZEDMIEŚCIU DUBIECKIM,"Przedmieście Dubieckie 140, 37-750 Przedmieście Dubieckie",1813025
szkola,ZESPÓŁ SZKÓŁ NR 1 IM. PROF. WILHELMA ROTKIEWICZA W DZIERŻONIOWIE,"Adama Mickiewicza 8, 58-200 Dzierżoniów",0202021
szkola,ZESPÓŁ SZKÓŁ NR 3 IM MIKOŁAJA KOPERNIKA W ŁAŃCUCIE,"Farna 10, 37-100 Łańcut",1810011
szkola,PAŃSTWOWA SZKOŁA MUZYCZNA I I II STOPNIA IM. FRANCISZKA LISZTA W GŁOGOWIE,"Jedności Robotniczej 14, 67-200 Głogów",0203011
szkola,ZESPÓŁ SZKÓŁ NR 2 IM. PROF. TADEUSZA KOTARBIŃSKIEGO W DZIERŻONIOWIE,"marsz. Józefa Piłsudskiego 24, 58-200 Dzierżoniów",0202021
szkola,ZESPÓŁ SZKÓŁ W WOLI RANIŻOWSKIEJ,"Wola Raniżowska 317, 36-125 Wola Raniżowska",1806052
szkola,ZESPÓŁ SZKÓŁ PONADPODSTAWOWYCH IM. HIPOLITA CEGIELSKIEGO W ZIĘBICACH,"Wojska Polskiego 3, 57-220 Ziębice",0224064
szkola,PAŃSTWOWA SZKOŁA MUZYCZNA I I II ST. IM. STANISŁAWA MONIUSZKI W JELENIEJ GÓRZE,"Józefa Piłsudskiego 26, 58-500 Jelenia Góra",0261011
szkola,ZESPÓŁ SZKÓŁ ZAWODOWYCH NR 4 IM. A. CHĘTNIKA W OSTROŁĘCE,"Romualda Traugutta 10, 07-410 Ostrołęka",1461011
szkola,PAŃSTWOWA SZKOŁA MUZYCZNA I I II ST. IM. WITOLDA LUTOSŁAWSKIEGO W NYSIE,"Solny 2, 48-300 Nysa",1607054
szkola,ZESPÓŁ SZKÓŁ TECHNICZNYCH IM. GEN. ZYGMUNTA BOHUSZA-SZYSZKO W CHEŁMIE,"Graniczna 2, 22-100 Chełm",0662011
szkola,ZESPÓŁ SZKÓŁ IM.ŚWIĘTEJ RODZINY W LUTCZY,"Lutcza 629, 38-112 Lutcza",1819032
szkola,ZESPÓŁ SZKÓŁ NR 40 IM. STEFANA STARZYŃSKIEGO W WARSZAWIE,"Objazdowa 3, 03-771 Praga-Północ",1465088
szkola,ZESPÓŁ SZKÓŁ NR 4 IM. KRÓLOWEJ JADWIGI W DĄBROWIE GÓRNICZEJ,"Łęknice 35, 41-303 Dąbrowa Górnicza",2465011
szkola,ZESPÓŁ SZKÓŁ OGÓLNOKSZTAŁCĄCYCH W ŚWIĘTOCHŁOWICACH,"Sudecka 5, 41-608 Świętochłowice",2476011
szkola,ZESPÓŁ SZKÓŁ TECHNICZNYCH I ZAWODOWYCH IM. AUGUSTYNA ŚWIDRA W ŚWIĘTOCHŁOWICACH,"Władysława Sikorskiego 9, 41-600 Świętochłowice",2476011
szkola,SALEZJAŃSKI ZESPÓŁ SZKÓŁ PUBLICZNYCH DON BOSKO W ŚWIĘTOCHŁOWICACH,"Wojska Polskiego 82, 41-603 Świętochłowice",2476011
szkola,MIEJSKI ZESPÓŁ SZKÓŁ NR 7 W KROŚNIE,"Powstańców Śląskich 37, 38-400 Krosno",1861011
szkola,BIESZCZADZKI ZESPÓŁ PLACÓWEK SZKOLNO-WYCHOWAWCZYCH W USTRZYKACH DOLNYCH,"Witolda Gombrowicza 37, 38-700 Ustrzyki Dolne",1801084
szkola,ZESPÓŁ SZKÓŁ PONADPODSTAWOWYCH W BIAŁOGARDZIE,"Stefana Kardynała Wyszyńskiego 14, 78-200 Białogard",3201011
szkola,ZESPÓŁ SZKÓŁ MUZYCZNYCH IM. STANISŁAWA MONIUSZKI W WAŁBRZYCHU,"Piętnastolecia 24, 58-309 Wałbrzych",0265011
szkola,POWIATOWY OŚRODEK POMOCY PSYCHOLOGICZNO-PEDAGOGICZNEJ W ZŁOTORYI,"Szkolna 1, 59-500 Złotoryja",0226021
szkola,ZESPÓŁ SZKÓŁ OGÓLNOKSZTAŁCĄCYCH W AUGUSTOWIE,"Śródmieście 31, 16-300 Augustów",2001011
szkola,ZESPÓŁ SZKÓŁ W ZARZECZU,"Świętego Jana Pawła II 7, 37-205 Zarzecze",1814092
szkola,ZESPÓŁ SZKOLNO-PRZEDSZKOLNY W DALESZYCACH,"Henryka Sienkiewicza 11B, 26-021 Daleszyce",2604054
szkola,ZESPÓŁ SZKÓŁ – MAŁOPOLSKA SZKOŁA GOŚCINNOŚCI IM. TYTUSA CHAŁUBIŃSKIEGO W MYŚLENICACH,"Zdrojowa 18, 32-400 Myślenice",1209034
szkola,ZESPÓŁ SZKÓŁ W KARLINIE,"Księdza Brzóski 6, 78-230 Karlino",3201034
szkola,ZESPÓŁ SZKOLNO-PRZEDSZKOLNY W RAKOWIE,"Łagowska 25, 26-035 Raków",2604162
szkola,ZESPÓŁ SZKÓŁ UZDROWISKOWYCH W RABCE,"Słowackiego 10, 34-700 Rabka-Zdrój",1211124
szkola,PAŃSTWOWA SZKOŁA MUZYCZNA I I II ST. IM. FELIKSA NOWOWIEJSKIEGO W ZGORZELCU,"Mariana Langiewicza 29, 59-900 Zgorzelec",0225021
szkola,ZESPÓŁ SZKÓŁ W SIEDLISZCZU,"Szkolna 64, 22-130 Siedliszcze",0603114
szkola,ZESPÓŁ SZKÓŁ ENERGETYCZNYCH W KRAKOWIE,"Loretańska 16, 31-114 Kraków-Śródmieście",1261059
szkola,ZESPÓŁ SZKÓŁ MECHANICZNYCH NR 2 IM. KAZIMIERZA GÓRSKIEGO W KRAKOWIE,"Aleja gen. Jana Skrzyneckiego 12, 30-363 Kraków-Podgórze",1261049
szkola,ZESPÓŁ SZKÓŁ NR 3 IM. KOMBATANTÓW RZECZYPOSPOLITEJ POLSKIEJ W DZIERŻONIOWIE,"Słowiańska 6, 58-200 Dzierżoniów",0202021
szkola,ZESPÓŁ SZKÓŁ POLIGRAFICZNO-MEDIALNYCH IM. ZENONA KLEMENSIEWICZA W KRAKOWIE,"Osiedle Tysiąclecia 38, 31-610 Kraków-Nowa Huta",1261039
szkola,ZESPÓŁ PAŃSTWOWYCH SZKÓŁ MUZYCZNYCH IM. STANISŁAWA MONIUSZKI W BIELSKU-BIAŁEJ,"Stanisława Wyspiańskiego 5a, 43-300 Bielsko-Biała",2461011
szkola,ZESPÓŁ EDUKACYJNY W KONOTOPIE,"Powstańców Wlkp. 7, 67-416 Konotop",0804032
szkola,ZESPÓŁ SZKÓŁ BUDOWLANYCH W NOWYM SĄCZU,"Szwedzka 17, 33-300 Nowy Sącz",1262011
szkola,ZESPÓŁ SZKÓŁ IM. JÓZEFA CZYŻEWSKIEGO W OPALENIU,"ks. Ludwika Warneckiego 10, 83-136 Opalenie",2214025
szkola,ZESPÓŁ SZKÓŁ NR 31 IM. JANA KILIŃSKIEGO,"Alojzego Felińskiego 13, 01-513 Żoliborz",1465198
szkola,ZESPÓŁ SZKÓŁ SAMOCHODOWYCH I LICEALNYCH NR 3 IM. IGNACEGO JANA PADEREWSKIEGO,"Włościańska 35, 01-710 Żoliborz",1465198
szkola,OGÓLNOKSZTAŁCĄCA SZKOŁA MUZYCZNA I I II STOPNIA IM. F. CHOPINA W BYTOMIU,"Stanisława Moniuszki 17, 41-902 Bytom",2462011
szkola,ZESPÓŁ SZKOLNO-PRZEDSZKOLNY W BORZĘCINIE DUŻYM,"Warszawska 697, 05-083 Borzęcin Duży",1432072
szkola,ZESPÓŁ SZKÓŁ SPECJALNYCH IM.JANA PAWŁA II W BIAŁOGARDZIE,"Zamoyskiego 3a, 78-200 Białogard",3201011
szkola,PAŃSTWOWA SZKOŁA MUZYCZNA I I II STOPNIA IM. GRZEGORZA FITELBERGA W CHORZOWIE,"gen. Henryka Dąbrowskiego 43, 41-500 Chorzów",2463011
szkola,PAŃSTWOWA SZKOŁA MUZYCZNA I I II ST. IM. IGNACEGO PADEREWSKIEGO W CIESZYNIE,"Zamkowa 3, 43-400 Cieszyn",2403011
szkola,ZESPÓŁ SZKÓŁ OGÓLNOKSZTAŁCĄCYCH W WĘGORZEWIE,"Bolesława Prusa 10, 11-600 Węgorzewo",2819034
szkola,ZESPÓŁ SZKÓŁ MUZYCZNYCH IM. MARCINA JÓZEFA ŻEBROWSKIEGO W CZĘSTOCHOWIE,"Jasnogórska 17, 42-200 Częstochowa",2464011
szkola,POWIATOWY ZESPÓŁ SZKÓŁ NR 2 IM. WINCENTEGO WITOSA W ŚRODZIE ŚLĄSKIEJ,"Kościuszki 60-62, 55-300 Środa Śląska",0218044
szkola,POWIATOWY ZESPÓŁ SZKÓŁ NR 1 IM. MIKOŁAJA KOPERNIKA W ŚRODZIE ŚLĄSKIEJ,"Wrocławska 12, 55-300 Środa Śląska",0218044
szkola,PAŃSTWOWA SZKOŁA MUZYCZNA I I II ST. IM. PROF. JÓZEFA ŚWIDRA W JASTRZĘBIU-ZDROJU,"Tadeusza Kościuszki 13a, 44-330 Jastrzębie-Zdrój",2467011
szkola,ZESPÓŁ JEDNOSTEK EDUKACYJNYCH WOJEWÓDZTWA MAŁOPOLSKIEGO W KRAKOWIE,"Osiedle Teatralne 4A, 31-945 Kraków-Nowa Huta",1261039
szkola,PAŃSTWOWA SZKOŁA MUZYCZNA I I II STOPNIA IM. MIECZYSŁAWA KARŁOWICZA W KATOWICACH,"Teatralna 16, 40-003 Katowice",2469011
szkola,ZESPÓŁ PAŃSTWOWYCH SZKÓŁ MUZYCZNYCH IM. WOJCIECHA KILARA W KATOWICACH,"Ułańska 7b, 40-887 Katowice",2469011
szkola,PAŃSTWOWA SZKOŁA MUZYCZNA I I II STOPNIA IM. STANISŁAWA MONIUSZKI W ZABRZU,"Władysława Reymonta 7a, 41-800 Zabrze",2478011
szkola,PAŃSTWOWA SZKOŁA MUZYCZNA I I II ST. IM. KAROLA I ANTONIEGO SZAFRANKÓW W RYBNIKU,"Powstańców Śląskich 27, 44-200 Rybnik",2473011
szkola,ZESPÓŁ SZKÓŁ GOSPODARCZYCH IM. MIKOŁAJA SPYTKA LIGĘZY,"Spytka Ligęzy 12, 35-055 Rzeszów",1863011
szkola,ZESPÓŁ SZKÓŁ BUDOWLANYCH I PLASTYCZNYCH IM. MIKOŁAJA KOPERNIKA,"Czarnieckiego 9, 86-300 Grudziądz",0462011
szkola,"ZESPÓŁ PLACÓWEK MŁODZIEŻOWYCH ""BURSA""","gen. Józefa Hallera 37, 86-300 Grudziądz",0462011
szkola,ZESPÓŁ SZKÓŁ OGÓLNOKSZTAŁCĄCYCH IM. BRONISŁAWA MALINOWSKIEGO W GRUDZIĄDZU,"Janusza Korczaka 23, 86-300 Grudziądz",0462011
szkola,ZESPÓŁ SZKÓŁ MECHANICZNYCH,"gen. Józefa Hallera 31, 86-300 Grudziądz",0462011
szkola,ZESPÓŁ SZKÓŁ TECHNICZNYCH IM. JANA I JĘDRZEJA ŚNIADECKICH,"Alfonsa Hoffmanna 1-7, 86-300 Grudziądz",0462011
szkola,ZESPÓŁ SZKÓŁ GASTRONOMICZNO-HOTELARSKICH IM. MARII SKŁODOWSKIEJ-CURIE,"Curie-Skłodowskiej 22, 86-300 Grudziądz",0462011
szkola,ZESPÓŁ SZKÓŁ ROLNICZYCH IM. WŁADYSŁAWA GRABSKIEGO,"Lipowa 33, 86-300 Grudziądz",0462011
szkola,ZESPÓŁ SZKÓŁ W CHORKÓWCE,"Chorkówka 199, 38-458 Chorkówka",1807012
szkola,ZESPÓŁ SZKÓŁ W ŚWIERZOWEJ POLSKIEJ,"Szkolna 31, 38-457 Świerzowa Polska",1807012
szkola,ZESPÓŁ SZKÓŁ IM. JANA III SOBIESKIEGO,"Jana III Sobieskiego 20, 62-200 Gniezno",3003011
szkola,ZESPÓŁ SZKOLNO-PRZEDSZKOLNY,"Mieszka I 21, 74-520 Cedynia",3206024
szkola,ZESPÓŁ SZKOLNO-PRZEDSZKOLNY W CZERNIEWICACH,"Mazowiecka 88, 97-216 Czerniewice",1016042
szkola,ZESPÓŁ SZKOLNO-PRZEDSZKOLNY W NURCU-STACJI,"Szkolna 6, 17-330 Nurzec-Stacja",2010072
szkola,ZESPÓŁ SZKÓŁ ŁĄCZNOŚCI IM. OBROŃCÓW POCZTY POLSKIEJ W GDAŃSKU W KRAKOWIE,"Monte Cassino 31, 30-337 Kraków-Podgórze",1261049
szkola,ZESPÓŁ SZKÓŁ ELEKTRYCZNYCH NR 2 W KRAKOWIE,"Osiedle Szkolne 26, 31-977 Kraków-Nowa Huta",1261039
szkola,ZESPÓŁ SZKÓŁ W JAŚLANACH,"Jaślany 432, 39-332 Jaślany",1811092
szkola,POWIATOWY ZESPÓŁ SPECJALNYCH PLACÓWEK SZKOLNO-WYCHOWAWCZYCH IM MARII GRZEGORZEWSKIEJ,"Nowa 1, 55-100 Trzebnica",0220034
szkola,ZESPÓŁ PAŃSTWOWYCH SZKÓŁ MUZYCZNYCH IM. MIECZYSŁAWA KARŁOWICZA W KRAKOWIE,"Osiedle Centrum E 2, 31-934 Kraków-Nowa Huta",1261039
szkola,MIEJSKI ZESPÓŁ SZKÓŁ NR 1,"Piękna 9, 38-300 Gorlice",1205011
szkola,PAŃSTWOWA SZKOŁA MUZYCZNA I I II ST. IM. FRYDERYKA CHOPINA W NOWYM SĄCZU,"Nawojowska 213, 33-300 Nowy Sącz",1262011
szkola,ZESPÓŁ SZKOLNO-PRZEDSZKOLNY W ŚWIĄTKACH,"Świątki 95, 11-008 Świątki",2814122
szkola,ZESPÓŁ SZKÓŁ KSZTAŁTOWANIA ŚRODOWISKA I AGROBIZNESU,"Tadeusza Kościuszki 23, 11-500 Giżycko",2806011
szkola,ZESPÓŁ SZKÓŁ MUNDUROWO - TECHNICZNYCH IM. ARMII KRAJOWEJ W OSTROWIE,"Dworska 2, 98-100 Ostrów",1003025
szkola,ZESPÓŁ SZKÓŁ EKONOMICZNYCH W NOWYM SĄCZU,"Grodzka 34, 33-300 Nowy Sącz",1262011
szkola,ZESPÓŁ SZKOLNO-PRZEDSZKOLNY W GNIEWOSZOWIE,"Konopnickiej 19, 26-920 Gniewoszów",1407032
szkola,ZESPÓŁ SZKÓŁ CENTRUM KSZTAŁCENIA ROLNICZEGO IM. WŁADYSŁAWA GRABSKIEGO W SĘDZIEJOWICACH,"Sędziejowice-Kolonia 10, 98-160 Sędziejowice-Kolonia",1003032
szkola,ZESPÓŁ SZKÓŁ W MALINIU,"Malinie 220, 39-331 Malinie",1811092
szkola,MIEJSKI ZESPÓŁ SZKÓŁ NR 3 W GORLICACH IM.ŚW.JANA KANTEGO,"kard. Stefana Wyszyńskiego 16, 38-300 Gorlice",1205011
szkola,ZESPÓŁ SZKÓŁ TECHNICZNYCH IM. PAPIEŻA JANA PAWŁA II,"Augusta Cieszkowskiego 17, 62-200 Gniezno",3003011
szkola,ZESPÓŁ SZKÓŁ ZAWODOWYCH W GIŻYCKU,"Tadeusza Kościuszki 16, 11-500 Giżycko",2806011
szkola,ZESPÓŁ SZKÓŁ ELEKTRONICZNYCH I INFORMATYCZNYCH IM. KOMISJI EDUKACJI NARODOWEJ,"Mickiewicza 27, 11-500 Giżycko",2806011
szkola,ZESPÓŁ SZKOLNO-PRZEDSZKOLNY W TRZEBOSZOWICACH,"Trzeboszowice 89, 48-370 Trzeboszowice",1607075
szkola,ZESPÓŁ SZKOLNO-PRZEDSZKOLNY W DZIEWIĘTLICACH PRZY STOWARZYSZENIU NA RZECZ ROZWOJU I PROMOCJI ZESPOŁU SZKOLNO-PRZEDSZKOLNEGO W DZIEWIĘTLICACH,"Dziewiętlice 78, 48-370 Dziewiętlice",1607075
szkola,ZESPÓŁ SZKOLNO-PRZEDSZKOLNY W PADNIEWIE,"Padniewo 55, 88-300 Padniewo",0409035
szkola,PAŃSTWOWA SZKOŁA MUZYCZNA I I II ST. IM. FRYDERYKA CHOPINA W NOWYM TARGU,"Parkowa 12, 34-400 Nowy Targ",1211011
szkola,ZESPÓŁ SZKÓŁ NR 1 IM. KOMISJI EDUKACJI NARODOWEJ W NOWYM SĄCZU,"Jagiellońska 84, 33-300 Nowy Sącz",1262011
szkola,ZESPÓŁ SZKÓŁ PONADPODSTAWOWYCH NR 3,"Henryka Sienkiewicza 6, 62-200 Gniezno",3003011
szkola,PAŃSTWOWA SZKOŁA MUZYCZNA I I II STOPNIA W WADOWICACH,"Legionów 11, 34-100 Wadowice",1218094
szkola,ZESPÓŁ PAŃSTWOWYCH SZKÓŁ ARTYSTYCZNYCH W ZAKOPANEM,"Henryka Sienkiewicza 12, 34-500 Zakopane",1217011
szkola,ZESPÓŁ SZKÓŁ GASTRONOMICZNYCH NR 1 IM. MJR. HENRYKA SUCHARSKIEGO W KRAKOWIE,"Osiedle Złotej Jesieni 16, 31-828 Kraków-Nowa Huta",1261039
szkola,ZESPÓŁ SZKÓŁ ELEKTRYCZNYCH NR 1 IM. POWSTAŃCÓW ŚLĄSKICH W KRAKOWIE,"Henryka Kamieńskiego 49, 30-644 Kraków-Podgórze",1261049
szkola,ZESPÓŁ SZKÓŁ MECHANICZNYCH NR 1 IM. SZCZEPANA HUMBERTA W KRAKOWIE,"Aleja Adama Mickiewicza 5, 31-120 Kraków-Śródmieście",1261059
szkola,ZESPÓŁ SZKÓŁ EKONOMICZNYCH NR 2 IM. IGNACEGO DASZYŃSKIEGO W KRAKOWIE,"Osiedle Spółdzielcze 6, 31-943 Kraków-Nowa Huta",1261039
szkola,ZESPÓŁ SZKÓŁ OGÓLNOKSZTAŁCĄCYCH MISTRZOSTWA SPORTOWEGO IM. J. KUSOCIŃSKIEGO,"Kozielska 19, 47-400 Racibórz",2411011
szkola,ZESPÓŁ SZKÓŁ ŁĄCZNOŚCI W WARSZAWIE,"Aleja Stanów Zjednoczonych 24, 03-964 Praga-Południe",1465078
szkola,ZESPÓŁ SZKÓŁ MUZYCZNYCH IM. STANISŁAWA MONIUSZKI W ŁODZI,"Łódź 20, 91-134 Łódź",1061011
szkola,ZESPÓŁ SZKÓŁ GASTRONOMICZNYCH NR 2 IM. PROF. ODONA BUJWIDA W KRAKOWIE,"Jana Zamoyskiego 6, 30-523 Kraków-Podgórze",1261049
szkola,ZESPÓŁ SZKÓŁ SAMORZĄDOWYCH W JANOWIE,"Białostocka 16, 16-130 Janów",2011022
szkola,ZESPÓŁ SZKÓŁ CHEMICZNYCH IM. MARII SKŁODOWSKIEJ-CURIE W KRAKOWIE,"Krupnicza 44, 31-123 Kraków-Śródmieście",1261059
szkola,ZESPÓŁ SZKÓŁ MECHANICZNYCH NR 3 IM. GENERAŁA WŁADYSŁAWA SIKORSKIEGO W KRAKOWIE,"Osiedle Szkolne 37, 31-978 Kraków-Nowa Huta",1261039
szkola,ZESPÓŁ SZKÓŁ IM. WŁADYSŁAWA SZAFERA W ZŁOTYM POTOKU,"Kościuszki 7, 42-253 Złoty Potok",2404035
szkola,ZESPÓŁ SZKÓŁ OGÓLNOKSZTAŁCĄCYCH NR 2 IM. MARII KONOPNICKIEJ W NOWYM SĄCZU,"Stefana Żeromskiego 16, 33-300 Nowy Sącz",1262011
szkola,ZESPÓŁ OŚWIATOWY W KOTUNIU,"Szkolna 2, 08-130 Kotuń",1426032
szkola,ZESPÓŁ SZKÓŁ SPOŁECZNYCH W GRZYBOWIE,"Grzybowo 32, 62-300 Grzybowo",3030055
szkola,ZESPÓŁ SZKÓŁ GEODEZYJNO-DROGOWYCH I GOSPODARKI WODNEJ IM. GABRIELA NARUTOWICZA W KRAKOWIE,"Juliusza Lea 235, 30-133 Kraków-Krowodrza",1261029
szkola,ZESPÓŁ SZKÓŁ ARCHITEKTONICZNO-BUDOWLANYCH W KRAKOWIE,"Jerzego Szablowskiego 1, 30-127 Kraków-Krowodrza",1261029
szkola,"ZESPÓŁ SZKÓŁ MECHANICZNYCH NR 4 IM. GENERAŁA AUGUSTA EMILA FIELDORFA ""NILA"" W KRAKOWIE","Podbrzezie 10, 31-054 Kraków-Śródmieście",1261059
szkola,ZESPÓŁ SZKÓŁ W KONIECPOLU,"Armii Krajowej 26, 42-230 Koniecpol",2404064
szkola,ZESPÓŁ PLACÓWEK OŚWIATOWYCH W WIELGIEM,"Szkolna 5, 87-603 Wielgie",0408092
szkola,PAŃSTWOWA SZKOŁA MUZYCZNA I I II STOPNIA IM. IGNACEGO JANA PADEREWSKIEGO W PIOTRKOWIE TRYBUNALSKIM,"inne Pasaż Karola Rudowskiego 4, 97-300 Piotrków Trybunalski",1062011
szkola,"ZESPÓŁ SZKÓŁ SPECJALNYCH PRZY OŚRODKU LECZNICZO-REHABILITACYJNYM ""PAŁAC KAMIENIEC"" S. Z O.O. W KAMIEŃCU","Gliwicka 3, 42-674 Kamieniec",2413092
szkola,ZESPÓŁ SZKÓŁ NR 3 IM.BOLESŁAWA BARBACKIEGO W NOWYM SĄCZU,"Szczęsnego Morawskiego 2, 33-300 Nowy Sącz",1262011
szkola,PAŃSTWOWA SZKOŁA MUZYCZNA I I II ST. IM. PROF. TADEUSZA WROŃSKIEGO W TOMASZOWIE MAZOWIECKIM,"Zapiecek 8, 97-200 Tomaszów Mazowiecki",1016011
szkola,PAŃSTWOWA SZKOŁA MUZYCZNA I I II ST. W ZDUŃSKIEJ WOLI,"Tadeusza Kościuszki 3, 98-220 Zduńska Wola",1019011
szkola,ZESPÓŁ SZKÓŁ SPECJALNYCH W OPOLNICY,"Opolnica 58, 57-256 Opolnica",0224015
szkola,POWIATOWE CENTRUM PORADNICTWA PSYCHOLOGICZNO-PEDAGOGICZNEGO W ZĄBKOWICACH ŚLĄSKICH,"Adama Mickiewicza 10, 57-200 Ząbkowice Śląskie",0224054
szkola,ZESPÓŁ SZKÓŁ ELEKTRYCZNO-MECHANICZNYCH IM. GEN. JÓZEFA KUSTRONIA W NOWYM SĄCZU,"Bolesława Limanowskiego 4, 33-300 Nowy Sącz",1262011
szkola,ZESPÓŁ SZKOLNO-PRZEDSZKOLNY W CEDZYNIE,"Szkolna 6, 25-900 Cedzyna",2604062
szkola,ZESPÓŁ SZKÓŁ OGÓLNOKSZTAŁCĄCYCH IM. MARII DĄBROWSKIEJ W KOMOROWIE,"Aleja Marii Dąbrowskiej 12/20, 05-806 Komorów",1421042
szkola,"ZESPÓŁ PLACÓWEK OŚWIATOWYCH IM. KS. PROF. J. TISCHNERA PRZY MAŁOPOLSKIM CENTRUM REHABILITACJI DZIECI ""SOLIDARNOŚĆ"" W RADZISZOWIE","Podlesie 173, 32-050 Radziszów",1206115
szkola,PAŃSTWOWA SZKOŁA MUZYCZNA I I II ST. IM. MIECZYSŁAWA KARŁOWICZA W MIELCU,"Tadeusza Kościuszki 10, 39-300 Mielec",1811011
szkola,ZESPÓŁ PAŃSTWOWYCH SZKÓŁ MUZYCZNYCH IM. ARTURA MALAWSKIEGO W PRZEMYŚLU,"Juliusza Słowackiego 91, 37-700 Przemyśl",1862011
szkola,PAŃSTWOWA SZKOŁA MUZYCZNA I I II STOPNIA IM. IGNACEGO JANA PADEREWSKIEGO W STALOWEJ WOLI,"Gabriela Narutowicza 11, 37-450 Stalowa Wola",1818011
szkola,ZESPÓŁ SZKÓŁ MUZYCZNYCH I I II ST. IM. FRYDERYKA CHOPINA W BIAŁEJ PODLASKIEJ,"Warszawska 12b, 21-500 Biała Podlaska",0661011
szkola,PAŃSTWOWA SZKOŁA MUZYCZNA I I II STOPNIA IM. WITOLDA LUTOSŁAWSKIEGO W KRASNYMSTAWIE,"Okrzei 10, 22-300 Krasnystaw",0606011
szkola,OGÓLNOKSZTAŁCĄCA SZKOŁA MUZYCZNA I I II ST. IM. KAROLA LIPIŃSKIEGO W LUBLINIE,"Muzyczna 10, 20-620 Lublin",0663011
szkola,POWIATOWY ZESPÓŁ NR 1 SZKÓŁ OGÓLNOKSZTAŁCĄCYCH IM. KS. STANISŁAWA KONARSKIEGO W OŚWIĘCIMIU,"Stanisława Konarskiego 24, 32-600 Oświęcim",1213011
szkola,MIEJSKI ZESPÓŁ SZKÓŁ NR 8 W KROŚNIE,"Prochownia 7, 38-400 Krosno",1861011
szkola,ZESPÓŁ SZKÓŁ NR 1,"Lipiańska 2, 74-200 Pyrzyce",3212054
szkola,POWIATOWY ZESPÓŁ NR 2 SZKÓŁ OGÓLNOKSZTAŁCĄCYCH MISTRZOSTWA SPORTOWEGO I TECHNICZNYCH IM. IGNACEGO ŁUKASIEWICZA W OŚWIĘCIMIU,"gen. Józefa Bema 8, 32-602 Oświęcim",1213011
szkola,ZESPÓŁ SZKÓŁ PONADPODSTAWOWYCH NR 1 IM. JANA SZCZEPANIKA W KROŚNIE,"Podkarpacka 16, 38-400 Krosno",1861011
szkola,ZESPÓŁ SZKOLNO - PRZEDSZKOLNY W JEZIORKACH,"Pocztowa 12, 62-060 Jeziorki",3021145
szkola,ZESPÓŁ SZKÓŁ ZAWODOWYCH POLSKIEGO GÓRNICTWA NAFTOWEGO I GAZOWNICTWA IM. PROFESORA WALEREGO GOETLA W KRAKOWIE,"Brzozowa 5, 31-050 Kraków-Śródmieście",1261059
