kategoria,nazwa,adres,teryt_gmina
szkola,ZESPÓŁ SZKOLNO - PRZEDSZKOLNY W JASIENICY DOLNEJ,"Jasienica Dolna 156, 48-315 Jasienica Dolna",1607042
szkola,ZESPÓŁ PORADNI PSYCHOLOGICZNO-PEDAGOGICZNYCH W CIESZYNIE,"Ignacego Kraszewskiego 13a, 43-400 Cieszyn",2403011
szkola,MŁODZIEŻOWE CENTRUM EDUKACJI I READAPTACJI SPOŁECZNEJ W GONIĄDZU,"Plac 11 Listopada 37, 19-110 Goniądz",2008014
szkola,ZESPÓŁ PLACÓWEK OŚWIATOWYCH W SKARŻYSKU-KAMIENNEJ,"Zwycięzców 13, 26-110 Skarżysko-Kamienna",2610011
szkola,ZESPÓŁ SZKOLNO-PRZEDSZKOLNY NR 7,"26 Marca 66, 44-300 Wodzisław Śląski",2415041
szkola,POWIATOWE CENTRUM KSZTAŁCENIA ZAWODOWEGO I USTAWICZNEGO W DRAWSKU POMORSKIM,"Warmińska 1, 78-500 Drawsko Pomorskie",3203024
szkola,ZESPÓŁ SZKOLNO-PRZEDSZKOLNY NR 2 W MYSŁOWICACH,"Józefa Wybickiego 79, 41-400 Mysłowice",2470011
szkola,ZESPÓŁ SZKOLNO-PRZEDSZKOLNY NR 1 W MYSŁOWICACH,"Generała Jerzego Ziętka 116, 41-400 Mysłowice",2470011
szkola,ZESPÓŁ SZKÓŁ MECHANICZNO-ELEKTRONICZNYCH,"Jana III Sobieskiego 1, 41-902 Bytom",2462011
szkola,ZESPÓŁ SZKÓŁ W BOJANOWIE,"Parkowa 11, 37-433 Bojanów",1818022
szkola,ZESPÓŁ SZKÓŁ ADMINISTRACYJNO-EKONOMICZNYCH I OGÓLNOKSZTAŁCĄCYCH,"Stanisława Webera 6, 41-902 Bytom",2462011
szkola,GMINNY ZESPÓŁ SZKOLNO-PRZEDSZKOLNY W CZARNYM BORZE,"Sportowa 44, 58-379 Czarny Bór",0221042
szkola,ZESPÓŁ PLACÓWEK OŚWIATOWYCH NR 2 W SKARŻYSKU-KAMIENNEJ,"Konarskiego 17, 26-110 Skarżysko-Kamienna",2610011
szkola,ZESPÓŁ PLACÓWEK OŚWIATOWYCH NR 3 W SKARŻYSKU-KAMIENNEJ,"Sportowa 30, 26-110 Skarżysko-Kamienna",2610011
szkola,ZESPÓŁ PLACÓWEK OŚWIATOWYCH NR 4 W SKARŻYSKU-KAMIENNEJ,"Norwida 3, 26-110 Skarżysko-Kamienna",2610011
szkola,ZESPÓŁ SZKOLNO-PRZEDSZKOLNY NR 1 IM. JANUSZA KORCZAKA W ŻYWCU,"Moszczanicka 26, 34-300 Żywiec",2417011
szkola,ZESPÓŁ PLACÓWEK OŚWIATOWYCH NR 5 W SKARŻYSKU-KAMIENNEJ,"Zielna 29, 26-110 Skarżysko-Kamienna",2610011
szkola,ZESPÓŁ SZKOLNO-PRZEDSZKOLNY NR 2 IM. ORŁA BIAŁEGO W ŻYWCU,"Niezapominajki 14, 34-300 Żywiec",2417011
szkola,ZESPÓŁ SZKÓŁ W KOCKU,"Warszawska 41, 21-150 Kock",0608064
szkola,ZESPÓŁ PLACÓWEK OŚWIATOWYCH NR 1 W MIĘDZYRZECU PODLASKIM,"Warszawska 40, 21-560 Międzyrzec Podlaski",0601011
szkola,ZESPÓŁ PLACÓWEK OŚWIATOWYCH NR 2 W MIĘDZYRZECU PODLASKIM,"Partyzantów 8, 21-560 Międzyrzec Podlaski",0601011
szkola,ZESPÓŁ PLACÓWEK OŚWIATOWYCH NR 3 W MIĘDZYRZECU PODLASKIM,"Leśna 2, 21-560 Międzyrzec Podlaski",0601011
szkola,ZESPÓŁ SZKOLNO-PRZEDSZKOLNY W CISIU,"Mostowa 61, 05-074 Cisie",1412075
szkola,ZESPÓŁ SZKÓŁ MEDYCZNYCH W BRZEGU,"Ofiar Katynia 25, 49-300 Brzeg",1601011
szkola,POWIATOWY ZESPÓŁ PORADNI PSYCHOLOGICZNO-PEDAGOGICZNYCH WE WROCŁAWIU,"Tadeusza Kościuszki 131, 50-440 Wrocław-Krzyki",0264039
szkola,"ZESPÓŁ SZKÓŁ NR 2 IM. MJRA H. DOBRZAŃSKIEGO ""HUBALA"" W ALEKSANDROWIE KUJAWSKIM","gen. Władysława Sikorskiego 2, 87-700 Aleksandrów Kujawski",0401011
szkola,ZESPÓŁ SZKÓŁ NR 1 CENTRUM KSZTAŁCENIA PRAKTYCZNEGO W ALEKSANDROWIE KUJAWSKIM,"Stanisława Wyspiańskiego 4, 87-700 Aleksandrów Kujawski",0401011
szkola,CENTRUM KSZTAŁCENIA ZAWODOWEGO I USTAWICZNEGO W BYTOMIU,"Wrocławska 120, 41-902 Bytom",2462011
szkola,PAŃSTWOWE SZKOŁY BUDOWNICTWA-ZESPÓŁ SZKÓŁ,"Powstańców Śląskich 10, 41-902 Bytom",2462011
szkola,ZESPÓŁ SZKÓŁ TECHNICZNYCH,"Andrzeja Frycza Modrzewskiego 5, 41-907 Bytom",2462011
szkola,ZESPÓŁ SZKÓŁ GASTRONOMICZNO-HOTELARSKICH,"Stefana Żeromskiego 26, 41-902 Bytom",2462011
szkola,ZESPÓŁ SZKÓŁ USŁUGOWO-RZEMIEŚLNICZYCH,"Świętochłowicka 10, 41-909 Bytom",2462011
szkola,ZESPÓŁ SZKÓŁ SPOŁECZNYCH W DZIKOWCU,"Dzikowiec 95, 57-432 Dzikowiec",0208112
szkola,ZESPÓŁ SZKOLNO-PRZEDSZKOLNY NR 8 W KRAKOWIE,"Mieczysława Wrony 115, 30-399 Kraków-Podgórze",1261049
szkola,ZESPÓŁ SZKOLNO-PRZEDSZKOLNY NR 5 W KRAKOWIE,"Osiedle Oświecenia 30, 31-636 Kraków-Nowa Huta",1261039
szkola,ZESPÓŁ SZKOLNO-PRZEDSZKOLNY NR 6 W KRAKOWIE,"Józefa Dietla 70, 31-073 Kraków-Śródmieście",1261059
szkola,ZESPOŁ SZKÓŁ GMINY KRZEMIENIEWO PRZEDSZKOLE SZKOŁA PODSTAWOWA W GARZYNIE,"Leszczyńska 50, 64-120 Garzyn",3013012
szkola,ZESPÓŁ SZKOLNO-PRZEDSZKOLNY W WADOWICACH GÓRNYCH,"Wadowice Górne 133E, 39-308 Wadowice Górne",1811102
szkola,ZESPÓŁ SZKOLNO-PRZEDSZKOLNY NR 1 W PRUDNIKU,"Podgórna 9, 48-200 Prudnik",1610044
szkola,ZESPÓŁ SZKOLNO-PRZEDSZKOLNY NR 2 W PRUDNIKU,"Szkolna 12, 48-200 Prudnik",1610044
szkola,ZESPÓŁ SZKOLNO-PRZEDSZKOLNY NR 7 W KRAKOWIE,"Skotnicka 86, 30-394 Kraków-Podgórze",1261049
szkola,ZESPÓŁ SZKOLNO-PRZEDSZKOLNY NR 1 W GLIWICACH,"Jana Kilińskiego 1, 44-122 Gliwice",2466011
szkola,ZESPÓŁ SZKOLNO-PRZEDSZKOLNY NR 9 W KRAKOWIE,"Romana Prawocheńskiego 7, 31-998 Kraków-Nowa Huta",1261039
szkola,ZESPÓŁ SZKÓŁ OGÓLNOKSZTAŁCĄCYCH NR 18 W KRAKOWIE,"Senatorska 35, 30-106 Kraków-Krowodrza",1261029
szkola,ZESPÓŁ SZKOLNO - PRZEDSZKOLNY W CHOCIANOWICACH,"Chocianowice 78, 46-280 Chocianowice",1604032
szkola,"CENTRUM KSZTAŁCENIA ZAWODOWEGO I USTAWICZNEGO ""ELEKTRYK""","Kościuszki 28, 67-100 Nowa Sól",0804011
szkola,ZESPÓŁ SZKÓŁ PUBLICZNYCH NR 1 W SKARŻYSKU-KAMIENNEJ,"Sezamkowa 23, 26-110 Skarżysko-Kamienna",2610011
szkola,ZESPÓŁ SZKÓŁ NIEPUBLICZNYCH W JANOWCU WIELKOPOLSKIM,"3 Maja 30, 88-430 Janowiec Wielkopolski",0419034
szkola,ZESPÓŁ SZKOLNO-PRZEDSZKOLNY W KOLECZKOWIE,"Wejherowska 24, 84-207 Koleczkowo",2215092
szkola,ZESPÓŁ KSZTAŁCENIA I WYCHOWANIA W KOLBUDACH,"gen. Józefa Wybickiego 33, 83-050 Kolbudy",2204032
szkola,ZESPÓŁ SZKOLNO-PRZEDSZKOLNY W SŁOTWINIE,"Księdza Ferdynanda Sznajdrowicza 11, 34-324 Słotwina",2417062
szkola,ZESPÓŁ SZKOLNO - PRZEDSZKOLNY W CZEPIELOWICACH,"Czepielowice 31, 49-314 Czepielowice",1601052
szkola,ZESPÓŁ SZKÓŁ NR 1 IM. KAROLA WOJTYŁY-JANA PAWŁA II W BRODNICY,"Matejki 7, 87-300 Brodnica",0402011
szkola,ZESPÓŁ SZKOLNO-PRZEDSZKOLNY W STAREJ WSI,"Dolna 12, 43-330 Stara Wieś",2402095
szkola,POWIATOWY ZESPÓŁ NR 10 SZKÓŁ MECHANICZNO-ELEKTRYCZNYCH IM. MIKOŁAJA KOPERNIKA W KĘTACH,"Żwirki i Wigury 27a, 32-650 Kęty",1213044
szkola,ZESPÓŁ SZKÓŁ NR 1 IM MARSZAŁKA JÓZEFA KLEMENSA PIŁSUDSKIEGO W BIELSKU PODLASKIM,"Szkolna 12, 17-100 Bielsk Podlaski",2003011
szkola,ZESPÓŁ SZKÓŁ OGÓLNOKSZTAŁCĄCYCH I ZAWODOWYCH IM. MJRA H. SUCHARSKIEGO W BOLESŁAWCU,"Komuny Paryskiej 6, 59-700 Bolesławiec",0201011
szkola,ZESPÓŁ SZKÓŁ W RADOMINIE,"Radomin 14, 87-404 Radomin",0405052
szkola,ZESPÓŁ SZKÓŁ W GŁOGÓWKU,"Powstańców 34, 48-250 Głogówek",1610024
szkola,ZESPÓŁ SZKÓŁ OGÓLNOKSZTAŁCĄCYCH NR 1 W PRUDNIKU,"Gimnazjalna 2, 48-200 Prudnik",1610044
szkola,ZESPÓŁ SZKÓŁ ROLNICZYCH W PRUDNIKU,"Kościuszki 76, 48-200 Prudnik",1610044
szkola,ZESPÓŁ SZKOLNO-REWALIDACYJNY SZKOŁA ŻYCIA W RYBNIKU,"Orzepowicka 15a, 44-217 Rybnik",2473011
szkola,ZESPÓŁ SZKÓŁ W DRAWSKU POMORSKIM,"Połczyńska 7, 78-500 Drawsko Pomorskie",3203024
szkola,ZESPÓŁ SZKÓŁ EKONOMICZNYCH W BRZEGU,"Jana Pawła II 28, 49-300 Brzeg",1601011
szkola,ZESPÓŁ SZKÓŁ W STRZELNIE,"Gimnazjalna 7, 88-320 Strzelno",0409044
szkola,ZESPÓŁ KSZTAŁCENIA I WYCHOWANIA W BIELKÓWKU,"Brunona Gregorkiewicza 11, 83-050 Bielkówko",2204032
szkola,ZESPÓŁ SZKÓŁ W CHRZYPSKU WIELKIM,"Szkolna 34, 64-412 Chrzypsko Wielkie",3014012
szkola,ZESPÓŁ OŚWIATOWY W BOROWIU,"Aleksandra Sasimowskiego 3, 08-412 Borowie",1403032
szkola,ZESPÓŁ KSZTAŁCENIA I WYCHOWANIA W LUBLEWIE GDAŃSKIM,"Szkolna 5, 83-050 Lublewo Gdańskie",2204032
szkola,ZESPÓŁ SZKOLNO-PRZEDSZKOLNY NR 4 W KRAPKOWICACH,"Żeromskiego 34, 47-303 Krapkowice",1605024
szkola,ZESPÓŁ SZKÓŁ W GŁOSKOWIE,"Szkolna 6, 08-412 Głosków",1403032
szkola,ZESPÓŁ SZKÓŁ ZAWODOWYCH NR 1 IM. MARII SKŁODOWSKIEJ-CURIE W BRZEGU,"Słowiańska 18, 49-300 Brzeg",1601011
szkola,ZESPÓŁ SZKOLNO-PRZEDSZKOLNY NR 13,"Muzealny 20, 50-035 Wrocław-Stare Miasto",0264059
szkola,ZESPÓŁ SZKOŁY I PRZEDSZKOLI W ZAWICHOŚCIE,"Szkolna 15, 27-630 Zawichost",2609094
szkola,ZESPÓŁ SZKOLNO-PRZEDSZKOLNY NR 2 W SARNOWIE,"Szkolna 5, 42-512 Sarnów",2401062
szkola,ZESPÓŁ SZKOLNO-PRZEDSZKOLNY W GRZEGORZEWIE,"Szkolna 23, 62-640 Grzegorzew",3009052
szkola,ZESPÓŁ SZKOLNO-PRZEDSZKOLNY NR 18,"Poznańska 26, 53-630 Wrocław-Stare Miasto",0264059
szkola,ZESPÓŁ SZKOLNO - PRZEDSZKOLNY NR 1 W WIŚLE,"Kopydło 74, 43-460 Wisła",2403031
szkola,ZESPÓŁ SZKOŁY I PRZEDSZKOLA W CZYŻOWIE SZLACHECKIM,"Czyżów Szlachecki 2, 27-630 Czyżów Szlachecki",2609095
szkola,ZESPÓŁ SZKOLNO-PRZEDSZKOLNY W ŁUKCIE,"Warszawska 17, 14-105 Łukta",2815042
szkola,ZESPÓŁ SZKÓŁ OGÓLNOKSZTAŁCĄCYCH W KRUSZWICY,"Jana Kasprowicza 7, 88-150 Kruszwica",0407064
szkola,ZESPÓŁ SZKÓŁ W ZADZIMIU,"Szkolna 20, 99-232 Zadzim",1011062
szkola,ZESPÓŁ SZKÓŁ IM. ŚW. JADWIGI ŚLĄSKIEJ,"Dworcowa 10, 59-610 Wleń",0212054
szkola,ZESPÓŁ SZKÓŁ NR 2 IM.ŚW.JADWIGI KRÓLOWEJ W ANDRYCHOWIE,"Stefana Batorego 9, 34-120 Andrychów",1218014
szkola,ZESPÓŁ SZKÓŁ IM.KOMISJI EDUKACJI NARODOWEJ W KALWARII ZEBRZYDOWSKIEJ,"Jana Pawła II 3, 34-130 Kalwaria Zebrzydowska",1218034
szkola,ZESPÓŁ SZKÓŁ CENTRUM KSZTAŁCENIA USTAWICZNEGO IM.ŚW. JANA PAWŁA II W RADOCZY,"Dworska 8, 34-100 Radocza",1218082
szkola,ZESPÓŁ SZKOLNO-PRZEDSZKOLNY NR 1 W NOWYM DWORZE MAZOWIECKIM,"Młodzieżowa 1, 05-101 Nowy Dwór Mazowiecki",1414011
szkola,ZESPÓŁ SZKÓŁ SPECJALNYCH W WADOWICACH,"Juliusza Słowackiego 4, 34-100 Wadowice",1218094
szkola,ZESPÓŁ PLACÓWEK RESOCJALIZACYJNO-WYCHOWAWCZYCH W SKARŻYSKU-KAMIENNEJ,"Legionów 131, 26-110 Skarżysko-Kamienna",2610011
szkola,ZESPÓŁ SZKOLNO-PRZEDSZKOLNY NR 3 W NOWYM DWORZE MAZOWIECKIM,"Szkolna 3, 05-102 Nowy Dwór Mazowiecki",1414011
szkola,ZESPÓŁ SZKOLNO-PRZEDSZKOLNY NR 1,"Zielony Rynek 2, 05-825 Grodzisk Mazowiecki",1405044
szkola,ZESPÓŁ PLACÓWEK OŚWIATOWYCH NR 3 W MŁAWIE,"Ordona 14, 06-500 Mława",1413011
szkola,ZESPÓŁ SZKOLNO PRZEDSZKOLNY W KOSZARAWIE,"Koszarawa 434, 34-332 Koszarawa",2417052
szkola,ZESPÓŁ SZKÓŁ W SOLCU-ZDROJU,"1 Maja 18, 28-131 Solec-Zdrój",2601052
szkola,ZESPÓŁ SZKOLNO-PRZEDSZKOLNY W BUKOWCU,"Szkolna 3, 95-006 Bukowiec",1006032
szkola,ZESPÓŁ SZKÓŁ EKONOMICZNYCH IM. STEFANA ŻEROMSKIEGO W LEGNICY,"Chojnowska 100, 59-220 Legnica",0262011
szkola,ZESPÓŁ SZKÓŁ TECHNICZNYCH CENTRUM KSZTAŁCENIA USTAWICZNEGO IM. STANISŁAWA PŁOSKIEGO W CIECHANOWIE,"Mikołaja Kopernika 7, 06-400 Ciechanów",1402011
szkola,ZESPÓŁ PRZEDSZKOLNO - SZKOLNY W ROSTARZEWIE,"Rakoniewicka 23, 62-068 Rostarzewo",3005045
szkola,ZESPÓŁ SZKOLNO - PRZEDSZKOLNY W JABŁONNIE,"Nowotomyska 9, 64-308 Jabłonna",3005045
szkola,ZESPÓŁ PRZEDSZKOLNO - SZKOLNY ŁĄKIE,"Łąkie 81, 62-068 Łąkie",3005045
szkola,ZESPÓŁ PRZEDSZKOLNO - SZKOLNY RUCHOCICE,"Poznańska 23, 62-073 Ruchocice",3005045
szkola,ZESPÓŁ SZKOLNO-PRZEDSZKOLNY NR 4 Z ODDZIAŁAMI INTEGRACYJNYMI W BRZESZCZACH,"Szkolna 6, 32-620 Brzeszcze",1213024
szkola,ZESPÓŁ SZKOLNO-PRZEDSZKOLNY NR 5 W BRZESZCZACH,"A. Mickiewicza 3, 32-620 Brzeszcze",1213024
szkola,ZESPÓŁ SZKÓŁ NR 1 IM. GEN. JÓZEFA BEMA W CIECHANOWIE,"Powstańców Warszawskich 24, 06-400 Ciechanów",1402011
szkola,ZESPÓŁ SZKOLNO-PRZEDSZKOLNY NR 6 W JAWISZOWICACH,"Kusocińskiego 1, 32-626 Jawiszowice",1213025
szkola,ZESPÓŁ SZKÓŁ NR 2 IM. NOBLISTÓW POLSKICH W CHOSZCZNIE,"Polna 5, 73-200 Choszczno",3202024
szkola,ZESPÓŁ SZKOLNO-PRZEDSZKOLNY W WIĘCKOWICACH,"Gromadzka 7, 62-070 Więckowice",3021052
szkola,ZESPÓŁ PLACÓWEK OŚWIATOWYCH W JAWORZNI,"Jaworznia 93, 26-065 Jaworznia",2604145
szkola,ZESPÓŁ SZKÓŁ PUBLICZNYCH W ŁĘKNICY,"Wojska Polskiego 19A, 68-208 Łęknica",0811011
szkola,ZESPÓŁ SZKOLNO- PRZEDSZKOLNY W DZIEWINIE,"Dziewin 231, 32-708 Dziewin",1201032
szkola,ZESPÓŁ SZKOLNO-PRZEDSZKOLNY W ŚWINIARACH,"Świniary 174, 32-709 Świniary",1201032
szkola,ZESPÓŁ SZKOLNO-PRZEDSZKOLNY W MIKLUSZOWICACH,"Mikluszowice 228, 32-708 Mikluszowice",1201032
szkola,ZESPÓŁ SZKOLNO-PRZEDSZKOLNY W DRWINI,"Drwinia 173, 32-709 Drwinia",1201032
szkola,ZESPÓŁ SZKÓŁ NR 3 IM. STANISŁAWA STASZICA W CIECHANOWIE,"Stefana Okrzei 6, 06-400 Ciechanów",1402011
szkola,ZESPÓŁ SZKÓŁ NR 2 IM. ADAMA MICKIEWICZA W CIECHANOWIE,"Orylska 9, 06-400 Ciechanów",1402011
szkola,ZESPÓŁ SZKÓŁ OGÓLNOKSZTAŁCĄCYCH I TECHNICZNYCH IM. JANA PAWŁA II W SIEWIERZU,"Tadeusza Kościuszki 15, 42-470 Siewierz",2401074
szkola,ZESPÓŁ SZKÓŁ TECHNICZNYCH I ARTYSTYCZNYCH W LESKU,"Al. Jana Pawła II 18 A, 38-600 Lesko",1821034
szkola,ZESPÓŁ PLACÓWEK OŚWIATOWYCH W KOŚCIELCU,"Kościelec 14, 88-170 Kościelec",0407075
szkola,ZESPÓŁ SZKÓŁ SPECJALNYCH W GOLENIOWIE,"Niepodległości 1B, 72-100 Goleniów",3204024
szkola,ZESPÓŁ SZKÓŁ PONADPODSTAWOWYCH W GRODKOWIE,"Krakowska 20, 49-200 Grodków",1601034
szkola,ZESPÓŁ SZKÓŁ OGÓLNOKSZTAŁCĄCYCH I TECHNICZNYCH W USTCE,"Bursztynowa 12, 76-270 Ustka",2212011
szkola,ZESPÓŁ SZKÓŁ NR 1 IM. JÓZEFA PIŁSUDSKIEGO W LIMANOWEJ,"Józefa Piłsudskiego 81, 34-600 Limanowa",1207011
szkola,ZESPÓŁ SZKÓŁ TECHNICZNYCH I OGÓLNOKSZTAŁCĄCYCH IM. JANA PAWŁA II W LIMANOWEJ,"Zygmunta Augusta 8, 34-600 Limanowa",1207011
szkola,ZESPÓŁ SZKÓŁ PONADPODSTAWOWYCH IM. INŻ. JÓZEFA MARKA W MSZANIE DOLNEJ,"Józefa Marka 2, 34-730 Mszana Dolna",1207021
szkola,ZESPÓŁ SZKÓŁ IM. KOMISJI EDUKACJI NARODOWEJ W TYMBARKU,"Tymbark 349, 34-650 Tymbark",1207122
szkola,POWIATOWE CENTRUM ROZWOJU EDUKACJI W IŁAWIE,"Mikołaja Kopernika 8a, 14-200 Iława",2807011
szkola,ZESPÓŁ SZKÓŁ OGÓLNOKSZTAŁCĄCYCH I TECHNICZNYCH W CZELADZI,"Grodziecka 29, 41-250 Czeladź",2401021
szkola,ZESPÓŁ SZKÓŁ OGÓLNOKSZTAŁCĄCYCH I TECHNICZNYCH W WOJKOWICACH,"Źrałków 1, 42-580 Wojkowice",2401031
szkola,ZESPÓŁ SZKÓŁ OGÓLNOKSZTAŁCĄCYCH NR 14 W GLIWICACH,"Przedwiośnie 2, 44-119 Gliwice",2466011
szkola,ZESPÓŁ SZKOLNO-PRZEDSZKOLNY W BASZNI DOLNEJ,"Szkolna 24, 37-621 Basznia Dolna",1809042
szkola,ZESPÓŁ SZKOLNO-PRZEDSZKOLNY W DŹWIERZUTACH,"Sienkiewicza 2A, 12-120 Dźwierzuty",2817022
szkola,ZESPÓŁ SZKOLNO-PRZEDSZKOLNY IM. ZIEMI MAZURSKIEJ W ORZYNACH,"Orzyny 34, 12-120 Orzyny",2817022
szkola,ZESPÓŁ SZKOLNO - PRZEDSZKOLNY W KAMIONNIE,"Powstańców Wielkopolskich 2, 64-421 Kamionna",3014035
szkola,ZESPÓŁ SZKÓŁ OGÓLNOKSZTAŁCĄCYCH IM. KAZIMIERZA JAGIELLOŃCZYKA W LIDZBARKU WARMIŃSKIM,"Ignacego Krasickiego 4, 11-100 Lidzbark Warmiński",2809011
szkola,ZESPÓŁ SZKOLNO-PRZEDSZKOLNY NR 1 W RADOMIU,"Ofiar Firleja 14, 26-600 Radom",1463011
szkola,"ZESPÓŁ SZKÓŁ SKÓRZANO-ODZIEŻOWYCH, STYLIZACJI I USŁUG W RADOMIU","Jana i Jędrzeja Śniadeckich 5, 26-600 Radom",1463011
szkola,ZESPÓŁ SZKOLNO-PRZEDSZKOLNY W DŁUGOŁĘCE,"Szkolna 40, 55-095 Długołęka",0223022
szkola,ZESPÓŁ SZKÓŁ OGÓLNOKSZTAŁCĄCYCH W SĘDZISZOWIE,"Tadeusza Kościuszki 7, 28-340 Sędziszów",2602064
szkola,ZESPÓŁ SZKÓŁ W ZAKRZEWIE,"Leśna 3a, 87-707 Zakrzewo",0401092
szkola,ZESPÓŁ SZKÓŁ OGÓLNOKSZTAŁCĄCYCH NR 5 IM. ARMII KRAJOWEJ W GLIWICACH,"Sikornik 34, 44-122 Gliwice",2466011
szkola,ZESPÓŁ SZKOLNO-PRZEDSZKOLNY NR 17 W GLIWICACH,"Płocka 16, 44-164 Gliwice",2466011
szkola,ZESPÓŁ SZKÓŁ EKONOMICZNO-TECHNICZNYCH IM. CICHOCIEMNYCH W GLIWICACH,"Władysława Sikorskiego 132, 44-103 Gliwice",2466011
szkola,ZESPÓŁ SZKÓŁ SPECJALNYCH W ŚWIDNICY,"Rotmistrza Witolda Pileckiego 3, 58-100 Świdnica",0219011
szkola,ZESPÓŁ SZKÓŁ INŻYNIERII ŚRODOWISKA W TORUNIU,"Stefana Batorego 43/49, 87-100 Toruń",0463011
szkola,ZESPÓŁ SZKOLNO – PRZEDSZKOLNY W NOWEJ WSI,"Nowa Wieś 69, 05-660 Nowa Wieś",1406115
szkola,ZESPÓŁ SZKÓŁ OGÓLNOKSZTAŁCĄCYCH NR 2 W GLIWICACH,"Partyzantów 25, 44-113 Gliwice",2466011
szkola,ZESPÓŁ SZKOLNO-PRZEDSZKOLNY W MIRKOWIE,"Adama Mickiewicza 19, 55-095 Mirków",0223022
szkola,ZESPÓŁ SZKÓŁ I PLACÓWEK OŚWIATOWYCH IM. EMILA GODLEWSKIEGO W NYSIE,"Marii Rodziewiczówny 1, 48-303 Nysa",1607054
szkola,ZESPÓŁ SZKÓŁ USŁUGOWO - GOSPODARCZYCH,"Poznańska 36, 63-300 Pleszew",3020064
szkola,ZESPÓŁ SZKÓŁ SPECJALNYCH W BRZEGU,"Sergiusza Mossora 4, 49-300 Brzeg",1601011
szkola,ZESPÓŁ SZKÓŁ TECHNICZNO-INFORMATYCZNYCH W GLIWICACH,"Chorzowska 5, 44-100 Gliwice",2466011
szkola,ZESPÓŁ SZKÓŁ SPECJALNYCH IM. JANUSZA KORCZAKA W GLIWICACH,"Dolnej Wsi 74, 44-100 Gliwice",2466011
szkola,ZESPÓŁ SZKÓŁ NR 3 W KIELCACH,"Legionów 4, 25-035 Kielce",2661011
szkola,ZESPÓŁ SZKÓŁ EKONOMICZNYCH W WODZISŁAWIU ŚLĄSKIM,"Szkolna 1, 44-300 Wodzisław Śląski",2415041
szkola,ZESPÓŁ SZKÓŁ ELEKTRYCZNYCH IM. MAJORA HENRYKA SUCHARSKIEGO W GORZOWIE WLKP.,"gen. Jarosława Dąbrowskiego 33, 66-400 Gorzów Wielkopolski",0861011
szkola,ZESPÓŁ SZKÓŁ EKONOMICZNYCH IM. STEFANA STARZYŃSKIEGO W GORZOWIE WLKP.,"30 Stycznia 29, 66-400 Gorzów Wielkopolski",0861011
szkola,ZESPÓŁ SZKÓŁ GASTRONOMICZNYCH IM. FEBRONII GAJEWSKIEJ-KARAMAĆ W GORZOWIE WLKP.,"Okólna 35, 66-400 Gorzów Wielkopolski",0861011
szkola,I ZESPÓŁ SZKÓŁ IM. STANISŁAWA STASZICA WE WSCHOWIE,"Kościuszki 11, 67-400 Wschowa",0812034
szkola,ZESPÓŁ SZKÓŁ PONADPODSTAWOWYCH W WODZISŁAWIU ŚLĄSKIM,"Kardynała Stefana Wyszyńskiego 39, 44-300 Wodzisław Śląski",2415041
szkola,ZESPÓŁ SZKÓŁ TECHNICZNYCH W WODZISŁAWIU ŚLĄSKIM,"Pszowska 92, 44-300 Wodzisław Śląski",2415041
szkola,ZESPÓŁ SZKÓŁ NR 1 IM. MELCHIORA WAŃKOWICZA,"Łąki 2, 05-870 Błonie",1432014
szkola,ZESPÓŁ SZKÓŁ PONADPODSTAWOWYCH W RYDUŁTOWACH,"Obywatelska 30, 44-280 Rydułtowy",2415031
szkola,ZESPÓŁ SZKÓŁ IM. HENRYKA SIENKIEWICZA W GRABOWCU,"Wojsławska 1, 22-425 Grabowiec",0620022
szkola,ZESPÓŁ SZKOLNO - PRZEDSZKOLNY W CZERNICHOWIE,"Turystyczna 8, 34-311 Czernichów",2417022
szkola,ZESPÓŁ SZKÓŁ ŻEGLUGI ŚRÓDLĄDOWEJ IM. KMDR. BOLESŁAWA ROMANOWSKIEGO W NAKLE NAD NOTECIĄ,"gen. Henryka Dąbrowskiego 4, 89-100 Nakło nad Notecią",0410034
szkola,ZESPÓL SZKOLNO-PRZEDSZKOLNY NR 2 W LUBSTOWIE,"Kościelna 1a, 62-610 Lubstów",3010105
szkola,ZESPÓŁ SZKOLNO-PRZEDSZKOLNY W BORKOWIE,"Akacjowa 2, 80-180 Borkowo",2204042
szkola,ZESPÓŁ SZKÓŁ PONADPODSTAWOWYCH W PSZOWIE,"Romualda Traugutta 32, 44-370 Pszów",2415011
szkola,ZESPÓŁ SZKÓŁ BUDOWLANYCH W BRANIEWIE,"Wiejska 2, 14-500 Braniewo",2802011
szkola,ZESPÓŁ SZKÓŁ ZAWODOWYCH IM. JANA LISZEWSKIEGO W BRANIEWIE,"Gdańska 19, 14-500 Braniewo",2802011
szkola,ZESPÓŁ SZKÓŁ ZAWODOWYCH IM. STANISŁAWA STASZICA LIDZBARK WARMIŃSKI,"Orła Białego 5, 11-100 Lidzbark Warmiński",2809011
szkola,ZESPÓŁ SZKÓŁ NR 2 W CIACHCINIE,"Ciachcin Nowy 54, 09-230 Ciachcin Nowy",1419012
szkola,ZESPÓŁ SZKÓŁ NR 3 IM. TOWARZYSTWA PRZYJACIÓŁ DZIECI,"Zagroba 40, 09-230 Zagroba",1419012
szkola,ZESPÓŁ SZKÓŁ NR 4 W ZĄGOTACH,"Zągoty 11, 09-230 Zągoty",1419012
szkola,ZESPÓŁ SZKÓŁ SAMORZĄDOWYCH W KRYNKACH,"Aleja Szkolna 10, 16-120 Krynki",2011044
szkola,ZESPÓŁ SZKÓŁ OGÓLNOKSZTAŁCĄCYCH W ORNECIE,"1 Maja 28, 11-130 Orneta",2809054
szkola,ZESPÓŁ SZKÓŁ BUDOWLANYCH IM. KSIĘCIA JERZEGO II PIASTA W BRZEGU,"Kamienna 3, 49-300 Brzeg",1601011
szkola,ZESPÓŁ SZKOLNO-PRZEDSZKOLNY W WIŚNIOWEJ,"Wiśniowa 76, 38-124 Wiśniowa",1819052
szkola,ZESPÓŁ SZKOLNO-PRZEDSZKOLNY NR 2 W GDYNI,"Leopolda Staffa 10, 81-597 Gdynia",2262011
szkola,ZESPÓŁ SZKOLNO - PRZEDSZKOLNY W WIELKIEJ WSI,"Wielka Wieś 210, 32-830 Wielka Wieś",1216135
szkola,CENTRUM KSZTAŁCENIA ZAWODOWEGO I USTAWICZNEGO,"Nowomiejska 25, 87-800 Włocławek",0464011
szkola,CENTRUM NAUK TECHNICZNYCH W CHOJNICACH,"Kościerska 11-11a, 89-600 Chojnice",2202011
szkola,ZESPÓŁ PLACÓWEK OŚWIATOWYCH IM. JANA PAWŁA II W BUKOWIE,"Szkolna 8, 29-105 Bukowa",2613022
szkola,ZESPÓŁ SZKÓŁ EKONOMICZNYCH IM. CYRYLA RATAJSKIEGO W ŚREMIE,"Józefa Wybickiego 2, 63-100 Śrem",3026044
szkola,ZESPÓŁ PLACÓWEK OŚWIATOWYCH IM. RTM. WITOLDA PILECKIEGO W KRASOCINIE,"Floriańska 1, 29-105 Krasocin",2613022
szkola,ZESPÓŁ SZKOLNO-PRZEDSZKOLNY W STRÓŻEWIE,"Stróżewo 59, 64-800 Stróżewo",3001032
szkola,ZESPÓŁ SZKOLNO-PRZEDSZKOLNY W SOKÓŁKACH,"Sokółki 18, 62-530 Sokółki",3010032
szkola,ZESPÓŁ SZKOLNO-PRZEDSZKOLNY W ŁOWYNIU,"Szkolna 1, 64-426 Łowyń",3014035
szkola,ZESPÓŁ SZKOLNO-PRZEDSZKOLNY W KOZARZEWIE,"Kozarzew 4, 62-530 Kozarzew",3010032
szkola,ZESPÓŁ SZKÓŁ PONADPODSTAWOWYCH NR 2 W KOŃSKICH,"Warszawska 53, 26-200 Końskie",2605034
szkola,ZESPÓŁ SZKÓŁ ADMINISTRACYJNO - EKONOMICZNYCH,"Zwycięstwa 194, 81-540 Gdynia",2262011
szkola,ZESPÓŁ SZKÓŁ NR 2 IM. STANISŁAWA STASZICA W SZAMOTUŁACH,"Szczuczyńska 3, 64-500 Szamotuły",3024074
szkola,ZESPÓŁ SZKÓŁ EKONOMICZNYCH IM. MIKOŁAJA KOPERNIKA,"Mikołaja Kopernika 8, 25-336 Kielce",2661011
szkola,ZESPÓŁ SZKOLNO-PRZEDSZKOLNY W KOŚCIELNEJ WSI,"Kaliska 2, 62-811 Kościelna Wieś",3020052
szkola,ZESPÓŁ SZKÓŁ PONADPODSTAWOWYCH NR 1 W KOŃSKICH,"Stanisława Staszica 5, 26-200 Końskie",2605034
szkola,ZESPÓŁ SZKÓŁ W WIELENIU,"Drawska 1, 64-730 Wieleń",3002084
szkola,ZESPÓŁ SZKÓŁ NR 3 IM. HUGONA KOŁŁĄTAJA W SZAMOTUŁACH,"Adama Mickiewicza 4, 64-500 Szamotuły",3024074
szkola,ZESPÓŁ SZKOLNO-PRZEDSZKOLNY W HECZNAROWICACH,"Krakowska 110, 43-330 Hecznarowice",2402095
szkola,ZESPÓŁ SZKOLNO-PRZEDSZKOLNY W GOŁUCHOWIE,"Czartoryskich 53, 63-322 Gołuchów",3020052
szkola,ZESPÓŁ SZKOLNO-PRZEDSZKOLNY W JEDLCU,"Jedlec 154, 63-322 Jedlec",3020052
szkola,ZESPÓŁ SZKOLNO-PRZEDSZKOLNY W KUCHARKACH,"Kucharki 39, 63-322 Kucharki",3020052
szkola,"ZESPÓŁ SZKÓŁ ROLNICZO- TECHNICZNYCH, IM. BOHATERÓW WALKI Z FASZYZMEM W ZWOLENIU","Sienkiewicza 17, 26-700 Zwoleń",1436054
szkola,ZESPÓŁ SZKÓŁ W ANDRYCHOWIE ZDZ W KATOWICACH,"Rynek 12, 34-120 Andrychów",1218014
szkola,ZESPÓŁ SZKÓŁ NR 1 IM. POWSTAŃCÓW WIELKOPOLSKICH WE WRONKACH,"Leśna 17, 64-510 Wronki",3024084
szkola,ZESPÓŁ SZKOLNO-PRZEDSZKOLNY NR 10,"Dębicka 288, 35-213 Rzeszów",1863011
szkola,ZESPÓŁ SZKÓŁ HOTELARSKO-GASTRONOMICZNYCH,"Morska 77, 81-222 Gdynia",2262011
szkola,ZESPÓŁ SZKÓŁ NR 2 IM. STANISŁAWA KONARSKIEGO WE WRONKACH,"Powstańców Wielkopolskich 25, 64-510 Wronki",3024084
szkola,ZESPÓŁ SZKOLNO-PRZEDSZKOLNY W TURSKU,"Tursko 10, 63-322 Tursko",3020052
szkola,ZESPÓŁ SZKÓŁ EKONOMICZNYCH NR 1 IM. MIKOŁAJA KOPERNIKA W KRAKOWIE,"Kapucyńska 2, 31-113 Kraków-Śródmieście",1261059
szkola,ZESPÓŁ SZKOLNO PRZEDSZKOLNY W WOJKOWICACH KOŚCIELNYCH,"Zachodnia 4, 42-510 Wojkowice Kościelne",2401075
szkola,ZESPÓŁ SZKOLNO PRZEDSZKOLNY,"Przyszłości 9, 42-470 Żelisławice",2401075
szkola,ZESPÓŁ SZKÓŁ SPECJALNYCH IM. JANA BRZECHWY W SZAMOTUŁACH,"Hugona Kołłątaja 1, 64-500 Szamotuły",3024074
szkola,ZESPÓŁ SZKÓŁ W ŻĘBOCINIE,"Żębocin 65, 32-100 Żębocin",1214055
szkola,ZESPÓŁ WCZESNEJ EDUKACJI NR 1,"Wiczlińska 33, 81-578 Gdynia",2262011
szkola,ZESPÓŁ SZKÓŁ CHŁODNICZYCH I ELEKTRONICZNYCH,"Sambora 48, 81-201 Gdynia",2262011
szkola,POWIATOWY ZESPÓŁ PORADNI PSYCHOLOGICZNO-PEDAGOGICZNYCH W SZAMOTUŁACH,"Bolesława Chrobrego 8, 64-500 Szamotuły",3024074
szkola,ZESPÓŁ SZKÓŁ OGÓLNOKSZTAŁCĄCYCH SPECJALNYCH NR 7 W GLIWICACH,"Aleksandra Gierymskiego 7, 44-102 Gliwice",2466011
szkola,ZESPÓŁ SZKÓŁ PRZEMYSŁU SPOŻYWCZEGO,"Zagórska 14, 25-355 Kielce",2661011
szkola,ZESPÓŁ SZKÓŁ PONADPODSTAWOWYCH W PRZEDBORZU,"Piotrkowska 1, 97-570 Przedbórz",1012114
szkola,ZESPÓŁ SPORTOWYCH SZKÓŁ OGÓLNOKSZTAŁCĄCYCH,"Władysława IV 54, 81-384 Gdynia",2262011
szkola,ZESPÓŁ SZKÓŁ EKONOMICZNYCH IM. J. A. KOMEŃSKIEGO,"Księcia Józefa Poniatowskiego 2, 64-100 Leszno",3063011
szkola,ZESPÓŁ SZKÓŁ SPECJALNYCH NR 17,"Witomińska 25, 81-311 Gdynia",2262011
szkola,ZESPÓŁ SZKÓŁ OGÓLNOKSZTAŁCĄCYCH NR 6,"gen. Józefa Hallera 9, 81-453 Gdynia",2262011
szkola,ZESPÓŁ SZKÓŁ PONADPODSTAWOWYCH NR 3 W KOŃSKICH,"Marszałka Piłsudskiego 68, 26-200 Końskie",2605034
szkola,ZESPÓŁ SZKÓŁ W ŚWIĄTNIKACH GÓRNYCH,"Franciszka Bielowicza 20, 32-040 Świątniki Górne",1206144
szkola,ZESPÓŁ SZKÓŁ PUBLICZNYCH,"Kopernika 3, 83-250 Skarszewy",2213094
szkola,ZESPÓŁ SZKÓŁ OGÓLNOKSZTAŁCĄCYCH NR 4 IM. PIASTÓW ŚLĄSKICH W GLIWICACH,"Orląt Śląskich 25, 44-102 Gliwice",2466011
szkola,ZESPÓŁ SZKÓŁ W TUŁOWICACH,"Zamkowa 1, 49-130 Tułowice",1609124
szkola,ZESPÓŁ SZKÓŁ PONADPODSTAWOWYCH IM. STANISŁAWA STASZICA W STĄPORKOWIE,"Stanisława Staszica 4, 26-220 Stąporków",2605084
szkola,ZESPÓŁ PLACÓWEK OŚWIATOWYCH W PLATEROWIE,"Siedlecka 7, 08-210 Platerów",1410042
szkola,ZESPÓŁ SZKÓŁ SAMORZĄDOWYCH IM. JANA PAWŁA II W TERESZPOLU-ZAORENDZIE,"Szkolna 16, 23-407 Tereszpol-Zaorenda",0602132
szkola,ZESPÓŁ SZKOLNO-PRZEDSZKOLNY W KORFANTOWIE,"3 Maja 12, 48-317 Korfantów",1607034
szkola,ZESPÓŁ SZKÓŁ W JABŁONNIE,"Jabłonna Druga 45, 23-114 Jabłonna Druga",0609062
szkola,ZESPÓŁ SZKÓŁ W PIOTRKOWIE,"Piotrków Pierwszy 105, 23-114 Piotrków Pierwszy",0609062
szkola,ZESPÓŁ SZKOLNO-PRZEDSZKOLNY W DOBROSOŁOWIE,"Dobrosołowo 42, 62-530 Dobrosołowo",3010032
szkola,ZESPÓŁ SZKOLNO-PRZEDSZKOLNY NR 14 W KRAKOWIE,"Stawowa 179, 31-346 Kraków-Krowodrza",1261029
szkola,ZESPÓŁ SZKOLNO-PRZEDSZKOLNY NR 3 W KRAKOWIE,"Miodowa 36, 31-052 Kraków-Śródmieście",1261059
szkola,"ZESPÓŁ SZKÓŁ OGÓLNOKSZTAŁCĄCYCH NR 1-,,LICEUM I GIMNAZJUM CHEŁMIŃSKIE"" W CHEŁMNIE","Dominikańska 35, 86-200 Chełmno",0404011
szkola,CENTRUM OŚWIATOWE IM. STANISŁAWA WYSPIAŃSKIEGO W KOSZYCACH,"Marii Skłodowskiej-Curie 4, 32-130 Koszyce",1214024
szkola,ZESPÓŁ SZKOLNO-PRZEDSZKOLNY W TYKOCINIE,"Jana Kochanowskiego 1, 16-080 Tykocin",2002124
szkola,SZKOŁA MUZYCZNA I I II STOPNIA,"bp. Dominika 13a, 81-402 Gdynia",2262011
szkola,ZESPÓŁ PLACÓWEK OŚWIATOWYCH,"Rynek 21, 34-730 Mszana Dolna",1207021
szkola,POWIATOWY ZESPÓŁ SZKÓŁ W BODZENTYNIE,"Suchedniowska 6, 26-010 Bodzentyn",2604024
szkola,ZESPÓŁ SZKÓŁ W OSTASZEWIE,"Kościuszki 22, 82-112 Ostaszewo",2210032
