kategoria,nazwa,adres,teryt_gmina
szkola,CENTRUM KSZTAŁCENIA ZAWODOWEGO I USTAWICZNEGO W NOWEJ WSI,"Nowa Wieś 70A, 05-660 Nowa Wieś",1406115
szkola,ZESPÓŁ SZKÓŁ SALEZJAŃSKICH LUX SAPIENTIAE W SOKOŁOWIE PODLASKIM,"Księdza Bosco 1, 08-300 Sokołów Podlaski",1429011
szkola,CENTRUM KSZTAŁCENIA ZAWODOWEGO I USTAWICZNEGO W WARSZAWIE,"Grenadierów 30a, 04-062 Praga-Południe",1465078
szkola,CENTRUM KSZTAŁCENIA ZAWODOWEGO I USTAWICZNEGO NR 1 W PRZEMYŚLU,"Aleksandra Dworskiego 99, 37-700 Przemyśl",1862011
szkola,CENTRUM KSZTAŁCENIA ZAWODOWEGO I USTAWICZNEGO NR 2 W PRZEMYŚLU,"Harcmistrz Izydory Kossowskiej 1, 37-700 Przemyśl",1862011
szkola,ZESPÓŁ SZKÓŁ W ODOLANOWIE,"Jana Pawła II 1, 63-430 Odolanów",3017034
szkola,ZESPÓŁ SZKÓŁ NR 9 W KALISZU,"Prymasa Stefana Wyszyńskiego 22-24, 62-800 Kalisz",3061011
szkola,ZESPÓŁ SZKOLNO- PRZEDSZKOLNY NR 1 W PTASZKOWEJ,"Ptaszkowa 406, 33-333 Ptaszkowa",1210042
szkola,ZESPÓŁ SZKOLNO-PRZEDSZKOLNY W KRUŻLOWEJ WYŻNEJ,"Krużlowa Wyżna 205, 33-325 Krużlowa Wyżna",1210042
szkola,NIEPUBLICZNY ZESPÓŁ SZKOLNO-PRZEDSZKOLNY PRO NOVO BOGACZÓWUL. SZKOLNA 4,"Szkolna 4, 66-010 Bogaczów",0809055
szkola,ZESPÓŁ SZKOLNO-PRZEDSZKOLNY W KAMESZNICY,"Parkowa 70, 34-383 Kamesznica",2417092
szkola,EUREKA ZESPÓŁ SZKÓŁ,"gen. Leopolda Okulickiego 20, 35-206 Rzeszów",1863011
szkola,ZESPÓŁ SZKÓŁ W LUTOCINIE,"Szkolna 14, 09-317 Lutocin",1437042
szkola,ZESPÓŁ SZKÓŁ OGÓLNOKSZTAŁCĄCYCH I ZAWODOWYCH,"Michała Kościeszy-Kosmowskiego 5, 62-240 Trzemeszno",3003094
szkola,ZESPÓŁ NIEPUBLICZNYCH PLACÓWEK OŚWIATOWYCH PROWADZONY PRZEZ ZGROMADZENIE SIÓSTR ŚW. JÓZEFA W CZĘSTOCHOWIE,"Biskupa Teodora Kubiny 10/12, 42-226 Częstochowa",2464011
szkola,ZESPÓŁ SZKOLNO - PRZEDSZKOLNY W ŁĘTOWNI,"Łętownia 54, 37-700 Łętownia",1813082
szkola,ZESPÓŁ SZKOLNO-PRZEDSZKOLNY W BORUSZOWICACH,"Szkolna 2, 42-690 Boruszowice",2413082
szkola,ZESPÓŁ SZKOLNO PRZEDSZKOLNY W LELOWIE,"Szczekocińska 41, 42-235 Lelów",2404092
szkola,ZESPÓŁ SZKOLNO-PRZEDSZKOLNY W NOWYM STAWIE,"Wiejska 1C, 82-230 Nowy Staw",2209074
szkola,ZESPÓŁ SZKOLNO-PRZEDSZKOLNY W GRABINACH-ZAMECZKU,"Gdańska 88, 83-022 Grabiny-Zameczek",2204072
szkola,ZESPÓŁ SZKÓŁ W GORAJU,"Bednarska 8, 23-450 Goraj",0602064
szkola,PODKARPACKI ZESPÓŁ NIEPAŃSTWOWYCH SZKÓŁ MUZYCZNYCH W RZESZOWIE,"Kujawska 28, 35-323 Rzeszów",1863011
szkola,ZESPÓŁ PORADNI PSYCHOLOGICZNO-PEDAGOGICZNYCH W BIELSKU-BIAŁEJ,"Juliusza Słowackiego 45, 43-300 Bielsko-Biała",2461011
szkola,CENTRUM KSZTAŁCENIA ZAWODOWEGO I USTAWICZNEGO W ELBLĄGU,"Generała Józefa Bema 54, 82-300 Elbląg",2861011
szkola,POWIATOWY ZESPÓŁ SZKÓŁ POLICEALNYCH IM. ZDZISŁAWA KIETURAKISA W WEJHEROWIE,"Dworcowa 5, 84-200 Wejherowo",2215031
szkola,"ZESPÓŁ PLACÓWEK OŚWIATOWYCH ""ÓSEMKA"" W STRZELCACH OPOLSKICH","Księdza Józefa Wajdy 3, 47-100 Strzelce Opolskie",1611054
szkola,ZESPÓŁ KSZTAŁCENIA I WYCHOWANIA SPECJALNEGO W KARTUZACH,"3 Maja 34, 83-300 Kartuzy",2205024
szkola,ZESPÓŁ SZKÓŁ W JACIE,"Jata 85, 37-430 Jata",1812032
szkola,ZESPÓŁ SZKÓŁ W JEŻOWEM CENTRUM,"Jeżowe 135, 37-430 Jeżowe",1812032
szkola,ZESPÓŁ PLACÓWEK EDUKACYJNO-WYCHOWAWCZYCH W GOŁDAPI,"Wojska Polskiego 18, 19-500 Gołdap",2818034
szkola,ZESPÓŁ PLACÓWEK OŚWIATOWYCH W GLICHOWIE,"Glichów 29, 32-412 Glichów",1209092
szkola,ZESPÓŁ PLACÓWEK OŚWIATOWYCH W KOBIELNIKU,"Kobielnik 84, 32-412 Kobielnik",1209092
szkola,ZESPÓŁ PLACÓWEK SZKOLNO-WYCHOWAWCZO-REWALIDACYJNYCH W OSTRÓDZIE,"Grunwaldzka 14, 14-100 Ostróda",2815011
szkola,ZESPÓŁ SZKOLNO-PRZEDSZKOLNY W LUTYNI,"Lutynia 21A, 63-330 Lutynia",3020035
szkola,ZESPÓŁ SZKOLNO PRZEDSZKOLNY W KORYTNICY,"Henryka Sienkiewicza 14, 07-120 Korytnica",1433032
szkola,ZESPÓŁ SZKÓŁ CECHU RZEMIOSŁ RÓŻNYCH W BIELAWIE,"Polna 2, 58-260 Bielawa",0202011
szkola,ZESPÓŁ SZKÓŁ SAMORZĄDOWYCH W KLWOWIE,"Przysuska 4, 26-415 Klwów",1423032
szkola,ZESPÓŁ SZKÓŁ SPOŁECZNYCH IM. PROF. PIOTRA ZAREMBY W DZIWNOWIE,"Władysława Reymonta 8, 72-420 Dziwnów",3207014
szkola,ZESPÓŁ SZKÓŁ W OLKUSZU ZAKŁADU DOSKONALENIA ZAWODOWEGO W KATOWICACH,"Francesco Nullo 20, 32-300 Olkusz",1212054
szkola,ZESPÓŁ SZKOLNO-PRZEDSZKOLNY NR 1,"Krzemieniecka 24a, 94-017 Łódź-Polesie",1061049
szkola,ZESPÓŁ SZKOLNO-PRZEDSZKOLNY W GOSŁAWICACH,"Sierakowska 1, 46-380 Gosławice",1608015
szkola,ZESPÓŁ SZKÓŁ NIEPUBLICZNYCH W NOWYM SĄCZU,"Jana Kochanowskiego 3, 33-300 Nowy Sącz",1262011
szkola,ZESPÓŁ PLACÓWEK OŚWIATOWYCH W POŁCZYNIE - ZDROJU,"Grunwaldzka 33, 78-320 Połczyn-Zdrój",3216034
szkola,ZESPÓŁ SZKOLNO-PRZEDSZKOLNY W ŁĄKOCINACH,"Szkolna 14, 63-410 Łąkociny",3017042
szkola,ZESPÓŁ SZKOLNO-PRZEDSZKOLNY W SŁABOROWICACH,"Słaborowice 8, 63-410 Słaborowice",3017042
szkola,ZESPÓŁ SZKOLNO-PRZEDSZKOLNY WE FRANKLINOWIE,"Franklinów 43, 63-400 Franklinów",3017042
szkola,ZESPÓŁ SZKOLNO-PRZEDSZKOLNY W WYSOCKU WIELKIM,"Sadowska 2, 63-400 Wysocko Wielkie",3017042
szkola,ZESPÓŁ SZKÓŁ JEZUITÓW IM. ŚW. STANISŁAWA KOSTKI W GDYNI,"Tatrzańska 35, 81-313 Gdynia",2262011
szkola,ZESPÓŁ SZKÓŁ SALEZJAŃSKICH W PRZEMYŚLU,"Plac Błogosławionego Księdza Augusta Czartoryskiego 2, 37-700 Przemyśl",1862011
szkola,ZESPÓŁ SZKÓŁ PALLOTYŃSKICH,"Osiedle Krakowiaków 47, 31-964 Kraków-Nowa Huta",1261039
szkola,"ZESPÓŁ SZKÓŁ ""PASCAL"" W OTWOCKU","Michała Andriollego 8/2, 05-400 Otwock",1417021
szkola,ZESPÓŁ SZKÓŁ PASCAL W BYDGOSZCZY,"Józefa Twardzickiego 33b, 85-791 Bydgoszcz",0461011
szkola,ZESPÓŁ SZKÓŁ PASCAL W NYSIE,"Kupiecka 7a, 48-300 Nysa",1607054
szkola,SZKOŁY TĘCZA W ZGORZELCU,"Bohaterów II Armii Wojska Polskiego 16, 59-900 Zgorzelec",0225021
szkola,ZESPÓŁ SZKÓŁ PASCAL W WYSZKOWIE,"Geodetów 45, 07-200 Wyszków",1435054
szkola,ZESPÓŁ PAŃSTWOWYCH SZKÓŁ MUZYCZNYCH W ŻORACH,"Dworcowa 6, 44-240 Żory",2479011
szkola,ZESPÓŁ SZKÓŁ PASCAL W PŁOCKU,"Al. Stanisława Jachowicza 40, 09-400 Płock",1462011
szkola,ZESPÓŁ SZKÓŁ KATOLICKICH IM. KS. F. BLACHNICKIEGO W BIAŁYMSTOKU,"Sitarska 25, 15-850 Białystok",2061011
szkola,ZESPÓŁ SZKÓŁ NIEPUBLICZNYCH WAŁECKA AKADEMIA WIEDZY,"Bydgoska 50, 78-600 Wałcz",3217011
szkola,PRYWATNE CENTRUM KSZTAŁCENIA ZAWODOWEGO,"Kijowska 3, 03-738 Praga-Północ",1465088
szkola,ZESPÓŁ SZKÓŁ PASCAL W GRUDZIĄDZU,"23 Stycznia 26, 86-300 Grudziądz",0462011
szkola,ZESPÓŁ SZKÓŁ BUDOWLANYCH,"Grunwaldzka 152, 60-309 Poznań-Grunwald",3064029
szkola,ZESPÓŁ SZKÓŁ SPOŁECZNEGO TOWARZYSTWA OŚWIATOWEGO,"Muszlowa 15, 01-355 Bemowo",1465028
szkola,ZESPÓŁ SZKÓŁ MIĘDZYNARODOWYCH MONNET INTERNATIONAL SCHOOL,"Zbierska 5, 00-745 Mokotów",1465058
szkola,ZESPÓŁ SZKÓŁ W URSZULINIE,"Szkolna 23, 22-234 Urszulin",0619052
szkola,ZESPÓŁ SZKÓŁ NR 1 W JELEŚNI,"Rynek 11, 34-340 Jeleśnia",2417042
szkola,"ZESPÓŁ SZKÓŁ ""JAŚ I MAŁGOSIA"" SZKOŁY I PLACÓWKI TERAPEUTYCZNE","Boh. Warszawy 31-35, 78-400 Szczecinek",3215011
szkola,ZESPÓŁ SPOŁECZNEJ SZKOŁY PODSTAWOWEJ NR 1 I SPOŁECZNEGO PRZEDSZKOLA JĘZYKOWEGO IM. KS. PROF. JÓZEFA TISCHNERA W TARNOWIE,"Gumniska 47, 33-100 Tarnów",1263011
szkola,ZESPÓŁ SZKÓŁ NR 2 W JELEŚNI,"Żywiecka 17, 34-340 Jeleśnia",2417042
szkola,ZESPÓŁ SZKÓŁ NR 3 W KRZYŻOWEJ,"Szkolna 13, 34-335 Krzyżowa",2417042
szkola,ZESPÓŁ SZKÓŁ NR 5 W KORBIELOWIE,"Beskidzka 40, 34-335 Korbielów",2417042
szkola,ZESPÓŁ SZKÓŁ NR 6 W SOPOTNI MAŁEJ,"Sopotnia Mała 201, 34-340 Sopotnia Mała",2417042
szkola,ZESPÓŁ SZKÓŁ NR 7 W PRZYBOROWIE,"Jana Kazimierza 217, 34-340 Przyborów",2417042
szkola,WIELOZAWODOWY ZESPÓŁ SZKÓŁ IMIENIA ROTMISTRZA WITOLDA PILECKIEGO W ZATORZE,"Juliusza Słowackiego 15, 32-640 Zator",1213094
szkola,ZESPÓŁ SZKOLNO-PRZEDSZKOLNY W KAMIEŃSKU,"Sportowa 8, 97-360 Kamieńsk",1012054
szkola,ZESPÓŁ SZKOLNO PRZEDSZKOLNY W BESTWINIE,"Szkolna 11, 43-512 Bestwina",2402022
szkola,ZESPÓŁ SZKOLNO PRZEDSZKOLNY W BESTWINCE,"Dworkowa 3, 43-512 Bestwinka",2402022
szkola,ZESPÓŁ SZKOLNO PRZEDSZKOLNY W JANOWICACH,"Janusza Korczaka 2, 43-512 Janowice",2402022
szkola,ZESPÓŁ SZKOLNO PRZEDSZKOLNY W KANIOWIE,"Batalionów Chłopskich 15, 43-512 Kaniów",2402022
szkola,ZESPÓŁ SZKOLNO-PRZEDSZKOLNY W STANOWICACH,"Świebodzka 6-9, 58-150 Stanowice",0219065
szkola,ZESPÓŁ SZKOLNO-PRZEDSZKOLNY NR 2,"Jugosłowiańska 2, 92-720 Łódź-Widzew",1061069
szkola,ZESPÓŁ OŚWIATOWY W GROCHOWIE,"Władysława Rawicza 1, 08-300 Grochów Szlachecki",1429082
szkola,PAŃSTWOWA SZKOŁA MUZYCZNA I I II ST. IM. KAROLA SZYMANOWSKIEGO W ZAMOŚCIU,"Tadeusza Kościuszki 5, 22-400 Zamość",0664011
szkola,ZESPÓŁ SZKÓŁ OGÓLNOKSZTAŁCĄCYCH SPOŁECZNEGO TOWARZYSTWA OŚWIATOWEGO W PILE,"aleja Powstańców Wielkopolskich 83, 64-920 Piła",3019011
szkola,NIEPUBLICZNY ZESPÓŁ SZKÓŁ DLA DOROSŁYCH - ZAOCZNE W GRÓJCU,"Polna 17A, 05-600 Grójec",1406054
szkola,ZESPÓŁ SZKÓŁ PASCAL W OSTRÓDZIE,"Stefana Czarnieckiego 15, 14-100 Ostróda",2815011
szkola,ZESPÓŁ SZKOLNO-PRZEDSZKOLNY NR 14 W RYBNIKU,"Leopolda Staffa 42a, 44-274 Rybnik",2473011
szkola,ZESPÓŁ SZKOLNO-PRZEDSZKOLNY W BRZEZINACH,"Aleksandra Świętochowskiego 1, 05-074 Brzeziny",1412075
szkola,OŚRODEK ROZWOJU POLSKIEJ EDUKACJI ZA GRANICĄ,"Janusza Kurtyki 4, 02-676 Mokotów",1465058
szkola,ZESPÓŁ SZKOLNO- PRZEDSZKOLNY W KICZYCACH,"Długa 52, 43-430 Kiczyce",2403105
szkola,ZESPÓŁ SZKÓŁ PONADGIMNAZJALNYCH PASCAL W BYTOMIU,"Michała Wolskiego 5, 41-902 Bytom",2462011
szkola,KATOLICKI ZESPÓŁ EDUKACYJNY W OSTROWCU ŚWIĘTOKRZYSKIM,"Grabowiecka 15, 27-400 Ostrowiec Świętokrzyski",2607011
szkola,ZESPÓŁ SZKOLNO-PRZEDSZKOLNY W JANKOWICACH,"Baziowa 17, 43-215 Jankowice",2410055
szkola,CENTRUM KSZTAŁCENIA ZAWODOWEGO I USTAWICZNEGO NR 1 W GLIWICACH,"Kozielska 1, 44-100 Gliwice",2466011
szkola,ZESPÓŁ PRZEDSZKOLI MIEJSKICH NR 1 W GLIWICACH,"Młodopolska 4, 44-119 Gliwice",2466011
szkola,ZESPÓŁ SZKOLNO-PRZEDSZKOLNY NR 3 W GLIWICACH,"Żwirki i Wigury 85, 44-122 Gliwice",2466011
szkola,ZESPÓŁ SZKOLNO-PRZEDSZKOLNY NR 4 W GLIWICACH,"Obrońców Pokoju 4, 44-105 Gliwice",2466011
szkola,ZESPÓŁ SZKOLNO-PRZEDSZKOLNY W RADLINIE,"Radlin 86, 26-008 Radlin",2604062
szkola,CENTRUM KSZTAŁCENIA ZAWODOWEGO I USTAWICZNEGO W OŁAWIE,"ks. Franciszka Kutrowskiego 31, 55-200 Oława",0215011
szkola,ZESPÓŁ SZKOLNO-PRZEDSZKOLNY W ROKICINACH PODHALAŃSKICH,"Rokiciny Podhalańskie 156, 34-721 Rokiciny Podhalańskie",1211112
szkola,ZESPÓŁ SZKOLNO-PRZEDSZKOLNY W KRUSZYNIE,"Kasztanowa 1, 59-700 Kruszyn",0201022
szkola,ZESPÓŁ SZKOLNO - PRZEDSZKOLNY W KRAŚNIKU DOLNYM,"Kraśnik Dolny 47, 59-700 Kraśnik Dolny",0201022
szkola,ZESPÓŁ SZKÓŁ W BIELICACH,"Bielice 120, 13-330 Bielice",2812022
szkola,CENTRUM KSZTAŁCENIA ZAWODOWEGO I USTAWICZNEGO W NIEPOŁOMICACH,"3 Maja 2, 32-005 Niepołomice",1219044
szkola,CENTRUM ROZWOJU EDUKACJI WOJEWÓDZTWA ŁÓDZKIEGO W ZGIERZU,"3 Maja 46, 95-100 Zgierz",1020031
szkola,ZESPÓŁ SZKOLNO-PRZEDSZKOLNY W ORZECHU,"Brzechwy 8, 42-622 Orzech",2413072
szkola,ZESPÓŁ SZKOLNO-PRZEDSZKOLNY W WOLI RĘBKOWSKIEJ,"Długa 90, 08-410 Wola Rębkowska",1403042
szkola,ZESPÓŁ SZKÓŁ NR 4 W SOPOTNI WIELKIEJ,"Sopotnia Wielka 298, 34-340 Sopotnia Wielka",2417042
szkola,ZESPÓŁ SZKÓŁ KATOLICKICH IM. ŚW. JANA PAWŁA II W ŚREMIE,"Stanisława Staszica 1, 63-100 Śrem",3026044
szkola,ZESPÓŁ SZKÓŁ NR 12 W LUBLINIE,"Sławinkowska 50, 20-810 Lublin",0663011
szkola,ZESPÓŁ SZKOLNO-PRZEDSZKOLNY W TYŃCU MAŁYM,"Szkolna 2, 55-040 Tyniec Mały",0223052
szkola,ZESPÓŁ SZKOLNO-PRZEDSZKOLNY W DULCZY WIELKIEJ,"ks. Kalinowskiego 212, 39-312 Dulcza Wielka",1811085
szkola,ZESPÓŁ SZKOLNO-PRZEDSZKOLNY W RUDZIE,"Ruda 124, 39-315 Ruda",1811085
szkola,ZESPÓŁ SZKOLNO-PRZEDSZKOLNY W DĄBIU,"Dąbie 100, 39-311 Dąbie",1811085
szkola,ZESPÓŁ SZKOLNO-PRZEDSZKOLNY NR 1 W ZDUŃSKIEJ WOLI,"Złota 67, 98-220 Zduńska Wola",1019011
szkola,ZESPÓŁ PRZEDSZKOLNY NR 1 W LUBLINIE,"Zachodnia 7, 20-620 Lublin",0663011
szkola,ZESPÓŁ SZKOLNO-PRZEDSZKOLNY W PARTYNI,"Partynia 66, 39-310 Partynia",1811085
szkola,ZESPÓŁ SZKOLNO-PRZEDSZKOLNY W ŻARÓWCE,"Żarówka 64, 39-312 Żarówka",1811085
szkola,ZESPÓŁ SZKOLNO-PRZEDSZKOLNY NR 3 Z ODDZIAŁAMI INTEGRACYJNYMI W CHEŁMIE,"Rejowiecka 76, 22-100 Chełm",0662011
szkola,ZESPÓŁ SZKOLNO-PRZEDSZKOLNY NR 3 W NAKLE NAD NOTECIĄ,"Mrotecka 1 a, 89-100 Nakło nad Notecią",0410034
szkola,ZESPÓŁ SZKÓŁ W KRZYWCZY,"Krzywcza 107, 37-755 Krzywcza",1813052
szkola,CENTRUM KSZTAŁCENIA ZAWODOWEGO I USTAWICZNEGO W POZNANIU IM. PORUCZNIK JANINY LEWANDOWSKIEJ,"Jawornicka 1, 60-161 Poznań-Grunwald",3064029
szkola,ZESPÓŁ OŚWIATOWY W SKIBNIEWIE,"Szkolna 8, 08-300 Skibniew-Podawce",1429082
szkola,ZESPÓŁ OŚWIATOWY W NOWEJ WSI,"Szkolna 2, 08-300 Nowa Wieś",1429082
szkola,ZESPÓŁ SZKOLNO-PRZEDSZKOLNY NR 5,"Astronautów 17, 02-154 Włochy",1465178
szkola,ZESPÓŁ SZKOLNO-PRZEDSZKOLNY W WOJNOWICACH,"Poznańska 5, 64-330 Wojnowice",3015055
szkola,ZESPÓŁ PLACÓWEK SPECJALNYCH W NYSIE,"Grodkowska 54, 48-300 Nysa",1607054
szkola,ZESPÓŁ SZKÓŁ W WOLI OKRZEJSKIEJ,"Henryka Sienkiewicza 96, 21-480 Wola Okrzejska",0611042
szkola,ZESPÓŁ SZKÓŁ W RADORYŻU SMOLANYM,"Radoryż Smolany 26, 21-470 Radoryż Smolany",0611042
szkola,ZESPÓŁ SZKÓŁ W FIUKÓWCE,"Fiukówka 9, 21-470 Fiukówka",0611042
szkola,ZESPÓŁ PORADNI PSYCHOLOGICZNO-PEDAGOGICZNYCH W OLEŚNICY,"Wojska Polskiego 67-69, 56-400 Oleśnica",0214011
szkola,MEDYCZNO-SPOŁECZNE CENTRUM KSZTAŁCENIA ZAWODOWEGO I USTAWICZNEGO W PRZEMYŚLU,"Waleriana Łukasińskiego 20, 37-700 Przemyśl",1862011
szkola,MEDYCZNO-SPOŁECZNE CENTRUM KSZTAŁCENIA ZAWODOWEGO I USTAWICZNEGO W JAŚLE,"Tadeusza Sroczyńskiego 2, 38-200 Jasło",1805011
szkola,MEDYCZNO-SPOŁECZNE CENTRUM KSZTAŁCENIA ZAWODOWEGO I USTAWICZNEGO W SANOKU,"Ks. Stanisława Konarskiego 3, 38-500 Sanok",1817011
szkola,POWIATOWY ZESPÓŁ PLACÓWEK OŚWIATOWYCH W ŁAŃCUCIE,"Armii Krajowej 51D, 37-100 Łańcut",1810011
szkola,MEDYCZNO-SPOŁECZNE CENTRUM KSZTAŁCENIA ZAWODOWEGO I USTAWICZNEGO W MIELCU,"Kościuszki 7, 39-300 Mielec",1811011
szkola,MEDYCZNO-SPOŁECZNE CENTRUM KSZTAŁCENIA ZAWODOWEGO I USTAWICZNEGO W RZESZOWIE,"Warzywna 1, 35-310 Rzeszów",1863011
szkola,ZESPÓŁ SZKOLNO - PRZEDSZKOLNY W LEŚNIAKOWIŹNIE,"Kasprzykiewicza 153, 05-200 Leśniakowizna",1434125
szkola,ZESPÓŁ SZKOLNO-PRZEDSZKOLNY W OSTROWITEM,"Ostrowite 42, 87-400 Ostrowite",0405032
szkola,ZACHODNIOPOMORSKIE CENTRUM KSZTAŁCENIA ZAWODOWEGO I USTAWICZNEGO W ŚWINOUJŚCIU,"Grodzka 3, 72-600 Świnoujście",3263011
szkola,CENTRUM KSZTAŁCENIA ZAWODOWEGO I USTAWICZNEGO,"Przechodnia 11/15, 42-202 Częstochowa",2464011
szkola,ZESPÓŁ PLACÓWEK EDUKACYJNO-WYCHOWAWCZYCH W TURKU,"Aleja Józefa Piłsudskiego 5, 62-700 Turek",3027011
szkola,ZESPÓŁ SZKÓŁ W PODLESZANACH,"Podleszany 127, 39-300 Podleszany",1811052
szkola,ZESPÓŁ PAŃSTWOWYCH SZKÓŁ MUZYCZNYCH W BOCHNI,"gen. Leopolda Okulickiego 1, 32-700 Bochnia",1201011
szkola,ZESPÓŁ SZKOLNO-PRZEDSZKOLNY W KAZUNIU NOWYM,"Główna 6, 05-152 Kazuń Nowy",1414022
szkola,ZESPÓŁ SZKOLNO - PRZEDSZKOLNY W SZCZERBICACH,"Szkolna 6, 44-293 Szczerbice",2412022
szkola,ZESPÓŁ SZKÓŁ OGÓLNOKSZTAŁCĄCYCH W KRZYŻU WIELKOPOLSKIM,"Henryka Sienkiewicza 1, 64-761 Krzyż Wielkopolski",3002044
szkola,ZESPÓŁ SZKÓŁ W ZAWADCE OSIECKIEJ,"Zawadka Osiecka 174, 38-223 Zawadka Osiecka",1805082
szkola,ZESPÓŁ SZKOLNO-PRZEDSZKOLNY W STARKOWIE,"Starkowo 94, 64-234 Starkowo",3029012
szkola,ZESPÓŁ SZKOLNO - PRZEDSZKOLNY W ZARZECZU ŁUKOWSKIM,"Zarzecz Łukowski 54, 21-400 Zarzecz Łukowski",0611052
szkola,ZESPÓŁ PLACÓWEK SPECJALNYCH W TCZEWIE,"Grunwaldzka 1, 83-110 Tczew",2214011
szkola,"ZESPÓŁ SZKÓŁ ""PASCAL"" WE WŁOCŁAWKU","Przechodnia 5, 87-800 Włocławek",0464011
szkola,CENTRUM KSZTAŁCENIA ZAWODOWEGO I USTAWICZNEGO W RADOMIU,"Kazimierza Kelles-Krauza 3, 26-600 Radom",1463011
szkola,ZESPÓŁ SZKOLNO-PRZEDSZKOLNY W BEŁŻCU,"Rzeszowska 75, 22-670 Bełżec",0618022
szkola,ZESPÓŁ SZKÓŁ SALEZJAŃSKICH W POZNANIU,"Bohaterów II Wojny Światowej 29, 61-387 Poznań-Nowe Miasto",3064049
szkola,SZKOŁA MISTRZOSTWA SPORTOWEGO W OSTRÓDZIE,"Adama Mickiewicza 32, 14-100 Ostróda",2815011
szkola,ZESPÓŁ SZKÓŁ W KOSOWIE LACKIM,"Armii Krajowej 6, 08-330 Kosów Lacki",1429054
szkola,ZESPÓŁ SPOŁECZNYCH SZKÓŁ OGÓLNOKSZTAŁCĄCYCH SPOŁECZNEGO TOWARZYSTWA OŚWIATOWEGO W ZAKOPANEM,"Kasprusie 35a, 34-500 Zakopane",1217011
szkola,POWIATOWY OŚRODEK ROZWOJU EDUKACJI W GIŻYCKU,"Smętka 5, 11-500 Giżycko",2806011
szkola,ZESPÓŁ SZKÓŁ PRYWATNYCH JANINY GOŚCIEJ W ZAKOPANEM,"Tytusa Chałubińskiego 30, 34-500 Zakopane",1217011
szkola,ZESPÓŁ PRZEDSZKOLI W OBORNIKACH,"Młyńska 2B, 64-600 Oborniki",3016014
szkola,ZESPÓŁ SZKOLNO-PRZEDSZKOLNY W NIDZIE,"Hosa 119, 26-026 Nida",2604125
szkola,POWIATOWE CENTRUM WSPIERANIA EDUKACJI W OLECKU,"Zamkowa 2, 19-400 Olecko",2813044
szkola,ZESPÓŁ SZKÓŁ AKSA W OLSZTYNIE,"św. Wojciecha 3/3a, 10-038 Olsztyn",2862011
szkola,ZESPÓŁ PRZEDSZKOLNY NR 1 W SIEMIANOWICACH ŚLĄSKICH,"Niepodległości 49, 41-106 Siemianowice Śląskie",2474011
szkola,"ZESPÓŁ SZKÓŁ SPOŁECZNYCH ""NASZA SZKOŁA""","Zwrotnicza 13, 41-807 Zabrze",2478011
szkola,ZESPÓŁ SZKÓŁ ATENA,"Żytnia 26, 41-205 Sosnowiec",2475011
szkola,ZESPÓŁ SZKÓŁ EUROPEJSKICH IM. SZARYCH SZEREGÓW W PUŁAWACH,"Zygmunta Wróblewskiego 8a, 24-100 Puławy",0614011
szkola,ZESPÓŁ EDUKACYJNY WŁODOWICE,"Włodowice 25, 57-400 Włodowice",0208112
szkola,ZESPÓŁ SZKÓŁ PRYWATNYCH DLA DOROSŁYCH „MONOLIT”,"Jasna 20, 25-523 Kielce",2661011
szkola,ZESPÓŁ SZKÓŁ KATOLICKICH W TCZEWIE,"Wodna 6, 83-110 Tczew",2214011
szkola,ZESPÓŁ SZKÓŁ IM. MACIEJA PŁAŻYŃSKIEGO SP. Z O.O. W PUCKU,"Przebendowskiego 12, 84-100 Puck",2211031
szkola,SZKOŁA SPOŁECZNA IM. CH. P. AIGNERA W PUŁAWACH,"Stanisława Moniuszki 1, 24-100 Puławy",0614011
szkola,"ZESPÓŁ SZKÓŁ KATOLICKICH FUNDACJI ""SZKOŁA Z CHARAKTEREM"" IM. EDYTY STEIN","Bałtycka 8, 44-100 Gliwice",2466011
szkola,ZESPÓŁ SZKÓŁ PASCAL W ŚWIECIU,"Wojska Polskiego 135a, 86-100 Świecie",0414094
szkola,ZESPÓŁ SZKÓŁ I PLACÓWEK OŚWIATOWYCH SZKOŁA RODZINNA,"Kruszyny 28, 05-077 Wesoła",1465158
szkola,ZESPÓŁ SZKOLNO-PRZEDSZKOLNY NR 5 W GLIWICACH,"Kozielska 39, 44-121 Gliwice",2466011
szkola,ZESPÓŁ SZKÓŁ ŁĄCZNOŚCI W GLIWICACH,"Warszawska 35, 44-100 Gliwice",2466011
szkola,ZESPÓŁ SZKOLNO-PRZEDSZKOLNY NR 6 W GLIWICACH,"Robotnicza 6, 44-100 Gliwice",2466011
szkola,ZESPÓŁ SZKOLNO-PRZEDSZKOLNY NR 7 W GLIWICACH,"Juliusza Ligonia 36, 44-100 Gliwice",2466011
szkola,ZESPÓŁ SZKOLNO-PRZEDSZKOLNY NR 8 W GLIWICACH,"Stefana Okrzei 16, 44-100 Gliwice",2466011
szkola,ZESPÓŁ SZKÓŁ OGÓLNOKSZTAŁCĄCYCH NR 1 W GDAŃSKU,"płk. Wilka-Krzyżanowskiego 8, 80-271 Gdańsk",2261011
szkola,ZESPÓŁ SZKÓŁ NR 1 W PIŃCZOWIE,"Szkolna 2, 28-400 Pińczów",2608044
szkola,CENTRUM KSZTAŁCENIA ZAWODOWEGO I USTAWICZNEGO W OSTROŁĘCE,"Parkowa 6, 07-412 Ostrołęka",1461011
szkola,NIEPUBLICZNY ZESPÓŁ SZKOLNO-PRZEDSZKOLNY,"Przytocko 17, 77-230 Przytocko",2212055
szkola,ZESPÓŁ SZKOLNO-PRZEDSZKOLNY NR 19,"Januszowicka 35-37, 53-135 Wrocław-Krzyki",0264039
szkola,CENTRUM MISTRZOSTWA SPORTOWEGO,"Mazurska 40, 70-424 Szczecin",3262011
szkola,ZESPÓŁ SZKOLNO - PRZEDSZKOLNY W PIOTROWICACH,"Piotrowice 139, 59-424 Piotrowice",0205032
szkola,CENTRUM KSZTAŁCENIA ZAWODOWEGO I USTAWICZNEGO NR 1,"Księcia Janusza 45/47, 01-452 Wola",1465188
szkola,ZESPÓŁ SZKOLNO-PRZEDSZKOLNY W SOKOLNIKACH,"Sandomierska 80, 39-432 Sokolniki",1820022
szkola,ZESPÓŁ SZKOLNO-PRZEDSZKOLNY W TRZEŚNI,"Szkolna 2, 39-432 Trześń",1820022
szkola,ZESPÓŁ SZKOLNO-PRZEDSZKOLNY W MOCHNACZCE WYŻNEJ,"Mochnaczka Wyżna b/n, 33-383 Mochnaczka Wyżna",1210075
szkola,ZESPÓŁ SZKOLNO-PRZEDSZKOLNY W MUSZYNCE,"Muszynka 16, 33-383 Muszynka",1210075
szkola,ZESPÓŁ SZKOLNO-PRZEDSZKOLNY W RACISZYNIE ZE SZKOŁĄ FILIALNĄ W KOLONII LISOWICE,"Działoszyńska 65, 98-355 Raciszyn",1009015
szkola,ZESPÓŁ SZKOLNO-PRZEDSZKOLNY W TRĘBACZEWIE,"Szkolna 5, 98-355 Trębaczew",1009015
szkola,ZESPÓŁ SZKÓŁ PONADPODSTAWOWYCH W ŁOCHOWIE,"Wyspiańskiego 18, 07-130 Łochów",1433054
szkola,POWIATOWY ZESPÓŁ PLACÓWEK OŚWIATOWYCH,"Wrocławska 2, 55-300 Środa Śląska",0218044
szkola,ZESPÓŁ EDUKACYJNY „DWUNASTKA” W OSTROWCU ŚWIĘTOKRZYSKIM,"Bałtowska 336a, 27-400 Ostrowiec Świętokrzyski",2607011
szkola,ZESPÓŁ EDUKACYJNO-PRZEDSZKOLNY SZKOŁA Z PASJĄ IM. ELŻBIETY SOŁTYS W OSTROWCU ŚWIĘTOKRZYSKIM,"Ferdynanda Focha 3, 27-400 Ostrowiec Świętokrzyski",2607011
szkola,ZESPÓŁ SZKOLNO-PRZEDSZKOLNY NR 2,"Łozowa 77, 61-448 Poznań-Wilda",3064069
szkola,ZESPÓŁ SZKÓŁ W BARCZEWIE,"Północna 14, 11-010 Barczewo",2814014
szkola,CENTRUM KSZTAŁENIA ZAWODOWEGO I USTAWICZNEGO W MIĘDZYRZECZU,"Marcinkowskiego 26, 66-300 Międzyrzecz",0803024
szkola,POWIATOWY MŁODZIEŻOWY DOM KULTURY I SPORTU W WIELUNIU,"3 Maja 29, 98-300 Wieluń",1017094
szkola,"CENTRUM KSZTAŁCENIA ZAWODOWEGO I USTAWICZNEGO NR 2 ""MECHANIK"" W RACIBORZU","Zamkowa 1, 47-400 Racibórz",2411011
szkola,CENTRUM KSZTAŁCENIA ZAWODOWEGO I USTAWICZNEGO NR 1 W RACIBORZU,"Wileńska 6, 47-400 Racibórz",2411011
szkola,ZESPÓŁ SZKÓŁ W ZALESZANACH,"Sandomierska 95, 37-415 Zaleszany",1818062
szkola,ZESPÓŁ SZKOLNO-PRZEDSZKOLNY W ZBYDNIOWIE,"Sandomierska 210, 37-415 Zbydniów",1818062
szkola,ZESPÓŁ NIEPUBLICZNYCH SZKÓŁ MUZYCZNYCH W KRAKOWIE,"Zygmunta Krasińskiego 20, 30-101 Kraków-Krowodrza",1261029
szkola,ZESPÓŁ SZKOLNO-PRZEDSZKOLNY NR 2 W TOMASZOWIE MAZOWIECKIM,"Wiejska 29/31, 97-200 Tomaszów Mazowiecki",1016011
szkola,ZESPÓŁ SZKOLNO-PRZEDSZKOLNY NR 3 W TOMASZOWIE MAZOWIECKIM,"Ludwikowska 113/115, 97-200 Tomaszów Mazowiecki",1016011
szkola,ZESPÓŁ PRZEDSZKOLNY W TOMASZOWIE MAZOWIECKIM,"Warszawska 103 A, 97-200 Tomaszów Mazowiecki",1016011
szkola,ZESPÓŁ SZKOLNO-PRZEDSZKOLNY W PODBORZU,"Podborze 101, 39-308 Podborze",1811085
szkola,CENTRUM KSZTAŁCENIA ZAWODOWEGO I USTAWICZNEGO W STRZAŁKOWIE,"Górna 12, 62-420 Strzałkowo",3023072
szkola,ZESPÓŁ SZKOLNO-PRZEDSZKOLNY WE WROCKACH,"Wrocki 14, 87-400 Wrocki",0405032
szkola,ZESPÓŁ MIEJSKICH PRZEDSZKOLI NR 1 W RUDZIE ŚLASKIEJ,"Wolności 43, 41-700 Ruda Śląska",2472011
szkola,ZESPÓŁ SZKOLNO-PRZEDSZKOLNY SACRÉ COEUR W TARNOWIE,"Pszenna 3, 33-101 Tarnów",1263011
szkola,ZESPÓŁ SZKÓŁ SPECJALNYCH STOWARZYSZENIA HANDICAP,"Stawowa 1a, 50-015 Wrocław-Stare Miasto",0264059
szkola,"ZESPÓŁ SZKÓŁ ""EKOLA"" FUNDACJI OŚWIATOWEJ ""EKOLA""","Tadeusza Zielińskiego 56, 53-534 Wrocław-Krzyki",0264039
szkola,ZESPÓŁ SZKOLNO PRZEDSZKOLNY W SZWARCENOWIE,"Szwarcenowo 36, 13-340 Szwarcenowo",2812022
szkola,ZESPÓŁ SZKOLNO-PRZEDSZKOLNY Z ODDZIAŁAMI INTEGRACYJNYMI W ŻARACH,"Broni Pancernej 8, 68-200 Żary",0811021
szkola,CENTRUM KSZTAŁCENIA ZAWODOWEGO I USTAWICZNEGO W LUDOWIE POLSKIM,"Ludów Polski 16, 57-100 Ludów Polski",0217045
szkola,ZESPÓŁ SZKOLNO - PRZEDSZKOLNY W WOLI MĘDRZECHOWSKIEJ,"Wola Mędrzechowska 127, 33-221 Wola Mędrzechowska",1204042
szkola,ZESPÓŁ SZKÓŁ I PLACÓWEK OŚWIATOWYCH W BIEŻYNIU,"Bieżyń 111, 64-010 Bieżyń",3011045
szkola,ZESPÓŁ PLACÓWEK EDUKACYJNO-TERAPEUTYCZNYCH W BOBROWIE,"Bobrowo 7, 78-520 Bobrowo",3203065
szkola,ZESPÓŁ PLACÓWEK OŚWIATOWYCH W PARYSOWIE,"Książęca 11, 08-441 Parysów",1403092
szkola,ZESPÓŁ SZKOLNO-PRZEDSZKOLNY W GOZDNICY,"Młyńska 1, 68-130 Gozdnica",0810011
szkola,ZESPÓŁ PRZEDSZKOLI W OTMUCHOWIE,"Jagiełły 3, 48-385 Otmuchów",1607064
szkola,ZESPÓŁ SZKOLNO-PRZEDSZKOLNY W ŁOBZOWIE,"Łobzów 220, 32-340 Łobzów",1212075
szkola,ZESPÓŁ SZKOLNO - PRZEDSZKOLNY W OKARTOWIE,"Okartowo 22, 12-250 Okartowo",2816025
szkola,ZESPÓŁ SZKOLNO - PRZEDSZKOLNY W ORZYSZU,"Wojska Polskiego 14, 12-250 Orzysz",2816024
szkola,ZESPÓŁ OŚWIATOWY W TOPORZE,"Topór 54, 07-104 Topór",1433082
szkola,ZESPÓŁ OŚWIATOWY W GRYGROWIE,"Grygrów 1b, 07-104 Grygrów",1433082
szkola,ZESPÓŁ SZKOLNO-PRZEDSZKOLNY W CHRUSTOWIE,"Chrustowo 13, 64-600 Chrustowo",3016015
szkola,ZESPÓŁ SZKOLNO-PRZEDSZKOLNY W OBJEZIERZU,"Objezierze 8, 64-600 Objezierze",3016015
szkola,ZESPÓŁ SZKOLNO-PRZEDSZKOLNY W MANIEWIE,"Maniewo 60, 64-605 Maniewo",3016015
szkola,ZESPÓŁ SZKOLNO-PRZEDSZKOLNY W KISZEWIE,"Kiszewo 51, 64-607 Kiszewo",3016015
szkola,ZESPÓŁ SZKOLNO-PRZEDSZKOLNY W ROŻNOWIE,"Dworcowa 42, 64-600 Rożnowo",3016015
szkola,ZESPÓŁ SZKÓŁ SAMORZĄDOWYCH W WITNICY,"Traugutta 1, 66-460 Witnica",0801074
szkola,ZESPÓŁ SZKOLNO - PRZEDSZKOLNY W BODZENTYNIE,"Rynek Górny 11, 26-010 Bodzentyn",2604024
szkola,ZESPÓŁ SZKÓŁ WE WZDOLE RZĄDOWYM,"Stara Wieś 28, 26-010 Stara Wieś",2604025
szkola,ZESPÓŁ SZKOLNO-PRZEDSZKOLNY NR 6 W TOMASZOWIE MAZOWIECKIM,"Juliusza Słowackiego 32/42, 97-200 Tomaszów Mazowiecki",1016011
szkola,ZESPÓŁ SZKOLNO-PRZEDSZKOLNY NR 4 W KALISZU,"Augustyna Kordeckiego 34, 62-800 Kalisz",3061011
szkola,ZESPÓŁ SZKOLNO-PRZEDSZKOLNY W WIELMOŻY,"Szkolna 55, 32-045 Wielmoża",1206132
szkola,ZESPÓŁ SZKOLNO-PRZEDSZKOLNY W STRZEBIELINIE OSIEDLU,"Marii Curie-Skłodowskiej 1, 84-220 Strzebielino-Osiedle",2215082
szkola,ZESPÓŁ SZKOLNO PRZEDSZKOLNY W WIETRZYCHOWICACH,"Wietrzychowice 64, 33-270 Wietrzychowice",1216122
szkola,ZESPÓŁ SZKÓŁ PONADPODSTAWOWYCH NR 8 W TOMASZOWIE MAZOWIECKIM,"Nadrzeczna 17/25, 97-200 Tomaszów Mazowiecki",1016011
szkola,CENTRUM KSZTAŁCENIA ZAWODOWEGO I USTAWICZNEGO W SIEDLCACH,"Młynarska 17, 08-110 Siedlce",1464011
szkola,ZESPÓŁ SZKOLNO-PRZEDSZKOLNY W JASIENIU,"Konopnickiej 10, 68-320 Jasień",0811044
szkola,ZESPÓŁ PLACÓWEK OŚWIATOWYCH W WINNICY,"Pułtuska 19, 06-120 Winnica",1424062
szkola,ZESPÓŁ SZKOLNO-PRZEDSZKOLNY NR 16 W KRAKOWIE,"Józefa Mackiewicza 15, 31-214 Kraków-Krowodrza",1261029
szkola,ZESPÓŁ PLACÓWEK OŚWIATOWYCH W LEŚNICY,"Kozielska 20, 47-150 Leśnica",1611044
szkola,ZESPÓŁ PLACÓWEK OŚWIATOWYCH IM. ALEKSANDRA DOBY W IWIĘCINIE,"Iwięcino 7, 76-004 Iwięcino",3209075
