kategoria,nazwa,adres,teryt_gmina
szkola,ZESPÓŁ SZKÓŁ W SIEMIĄTKOWIE,"Warszawska 3a, 09-135 Siemiątkowo",1437052
szkola,ZESPÓŁ SZKÓŁ IM. ŚW. KINGI W ŁĄCKU,"Łącko 26, 33-390 Łącko",1210092
szkola,ZESPÓŁ SZKÓŁ CENTRUM EDUKACJI IM. IGNACEGO ŁUKASIEWICZA,"Al. Floriana Kobylińskiego 25, 09-400 Płock",1462011
szkola,ZESPÓŁ SZKÓŁ STOWARZYSZENIA RODZIN KATOLICKICH ARCHIDIECEZJI KATOWICKIEJ IM. KARD. PRYMASA AUGUSTA HLONDA,"Tadeusza Kościuszki 11, 41-500 Chorzów",2463011
szkola,ZESPÓŁ SZKÓŁ IM. JANA KOCHANOWSKIEGO,"Warszawska 142, 42-202 Częstochowa",2464011
szkola,SAMORZĄDOWY ZESPÓŁ SZKOLNY IM. DZIECI ZAMOJSZCZYZNY W BISZCZY,"Biszcza 228A, 23-425 Biszcza",0602042
szkola,ZESPÓŁ SZKÓŁ EKONOMICZNYCH,"św. Augustyna 28/30, 42-226 Częstochowa",2464011
szkola,ZESPÓŁ SZKÓŁ GASTRONOMICZNYCH IM. MARII SKŁODOWSKIEJ-CURIE,"Stanisława Worcella 1, 42-202 Częstochowa",2464011
szkola,ZESPÓŁ SZKÓŁ SPECJALNYCH W KOWANÓWKU,"Miłowody 2, 64-600 Kowanówko",3016015
szkola,ZESPÓŁ SZKÓŁ IM.HIPOLITA CEGIELSKIEGO W ROGOŹNIE,"Wojska Polskiego 1, 64-610 Rogoźno",3016024
szkola,ZESPÓŁ SZKÓŁ IM. GEN. TADEUSZA KUTRZEBY W OBORNIKACH,"Księdza Stefana Szymańskiego 5, 64-600 Oborniki",3016014
szkola,ZESPÓŁ SZKÓŁ ROLNICZYCH W GRZYBNIE,"Grzybno 48, 63-112 Grzybno",3026012
szkola,ZESPÓŁ PLACÓWEK OŚWIATOWYCH W SŁOPNICACH,"Słopnice 732, 34-615 Słopnice",1207112
szkola,ZESPÓŁ PLACÓWEK OŚWIATOWYCH W SUCHOWOLI,"Szkolna 1, 16-150 Suchowola",2011094
szkola,ZESPÓŁ SZKOLNO-PRZEDSZKOLNY W WOLI ŁUŻAŃSKIEJ,"Wola Łużańska 52, 38-322 Wola Łużańska",1205062
szkola,ZESPÓŁ SZKÓŁ SPOŁECZNYCH W KRAJOWICACH,"Krajowice 33, 38-211 Krajowice",1805055
szkola,ZESPÓŁ SZKÓŁ NR 2 W ŁOSICACH,"Marszałka Józefa Piłsudskiego 9, 08-200 Łosice",1410024
szkola,ZESPÓŁ SZKÓŁ NR3 ROLNICZE CENTRUM KSZTAŁCENIA USTAWICZNEGO IM. STANISŁAWA STASZICA,"Radzyńska 1, 08-200 Łosice",1410024
szkola,ZESPÓŁ SZKÓŁ NR 1 W ŁOSICACH,"Szkolna 3, 08-200 Łosice",1410024
szkola,ZESPÓŁ PLACÓWEK SPECJALNYCH,"Fabryczna 1, 46-320 Praszka",1608044
szkola,ZESPÓŁ SZKÓŁ PONADPODSTAWOWYCH NR 5 IM. JÓZEFA PIŁSUDSKIEGO W ZAMOŚCIU,"Szczebrzeska 102, 22-400 Zamość",0664011
szkola,ZESPÓŁ SZKÓŁ PUBLICZNYCH W MILCZY,"Szkolna 16, 38-483 Milcza",1807085
szkola,ZESPÓŁ SZKÓŁ SPOŁECZNYCH W LUBLICY,"Lublica 79, 38-213 Lublica",1805055
szkola,ZESPÓŁ NIEPUBLICZNYCH SZKÓŁ SPECJALNYCH W KĘDZIERZYNIE- KOŹLU,"Piastowska 19, 47-200 Kędzierzyn-Koźle",1603011
szkola,ZESPÓŁ SZKÓŁ SPOŁECZNYCH IM. MARII I LECHA KACZYŃSKICH W SIEKLÓWCE,"Sieklówka 173, 38-214 Sieklówka",1805055
szkola,ZESPÓŁ SZKÓŁ SAMOCHODOWYCH,"św. Augustyna 3/7, 42-226 Częstochowa",2464011
szkola,ZESPÓŁ SZKOLNO- PRZEDSZKOLNY W PISARZOWICACH,"Pisarzowice 285b, 59-800 Pisarzowice",0210042
szkola,ZESPÓŁ SZKÓŁ PONADPODSTAWOWYCH NR 1 W ZAMOŚCIU,"Waleriana Łukasińskiego 8, 22-400 Zamość",0664011
szkola,ZESPÓŁ PLACÓWEK OŚWIATOWYCH W DROGINI,"Droginia 20, 32-400 Droginia",1209035
szkola,ZESPÓŁ SZKÓŁ SPOŁECZNYCH IM. JANA PAWŁA II W SOWINIE,"Sowina 1, 38-213 Sowina",1805055
szkola,TECHNICZNE ZAKŁADY NAUKOWE IM. GEN. WŁADYSŁAWA SIKORSKIEGO,"Jasnogórska 84/90, 42-217 Częstochowa",2464011
szkola,NIEPUBLICZNE CENTRUM KSZTAŁCENIA W BOCHNI,"Pod Lipką 5, 32-700 Bochnia",1201011
szkola,ZESPÓŁ SZKÓŁ NR 3 IM. JANA KOCHANOWSKIEGO W WYSZKOWIE,"Jana Matejki 9, 07-200 Wyszków",1435054
szkola,ZESPÓŁ SZKÓŁ IM. ORŁA BIAŁEGO W KORYTACH,"Koryta 66, 63-440 Koryta",3017065
szkola,ZESPÓŁ WOLSKICH PLACÓWEK EDUKACJI KULTURALNEJ,"Jana Brożka 1a, 01-442 Wola",1465188
szkola,ZESPÓŁ SZKÓŁ POLITECHNICZNYCH IM. POWSTAŃCÓW WIELKOPOLSKICH W ŚREMIE,"Ks. Jerzego Popiełuszki 30, 63-100 Śrem",3026044
szkola,ZESPÓŁ SZKÓŁ TECHNICZNYCH WE WŁOCŁAWKU,"Ogniowa 2, 87-800 Włocławek",0464011
szkola,ZESPÓŁ SZKOLNO-PRZEDSZKOLNY NR 3,"Marii Skłodowskiej-Curie 3, 44-313 Wodzisław Śląski",2415041
szkola,ZESPÓŁ SZKOLNO - PRZEDSZKOLNY STOWARZYSZENIA PRO-LIBERIS SILESIAE W RASZOWEJ,"Ozimska 55, 46-050 Raszowa",1609112
szkola,ZESPÓŁ SZKÓŁ W CZUDCU,"Parkowa 7, 38-120 Czudec",1819012
szkola,ZESPÓŁ PLACÓWEK OŚWIATOWYCH W KARSKU,"Gorzowska 9, 74-305 Karsko",3210052
szkola,ZESPÓŁ SZKÓŁ SPECJALNYCH IM. KORNELA MAKUSZYŃSKIEGO W GĘBICACH,"Polna 1, 64-707 Gębice",3002022
szkola,ZESPÓŁ SZKÓŁ ELEKTRYCZNYCH WE WŁOCŁAWKU,"Toruńska 77/83, 87-800 Włocławek",0464011
szkola,ZESPÓŁ SZKOŁY PODSTAWOWEJ I PRZEDSZKOLA NR 1 IM. JANUSZA KORCZAKA W RAKSZAWIE,"Rakszawa 347, 37-111 Rakszawa",1810062
szkola,ZESPÓŁ SZKÓŁ NR 1 W WĄGROWCU,"Kcyńska 48, 62-100 Wągrowiec",3028011
szkola,ZESPÓŁ SZKÓŁ NR 2 IM. PPŁK. DR. STANISŁAWA KULIŃSKIEGO W WĄGROWCU,"Kościuszki 49, 62-100 Wągrowiec",3028011
szkola,ZESPÓŁ SZKÓŁ ZAWODOWYCH NR 1 IM. 2 WARSZAWSKIEJ BRYGADY SAPERÓW I II LICEUM OGÓLNOKSZTAŁCĄCE IM. ANDRZEJA FRYCZA MODRZEWSKIEGO,"Modrzewskiego 24, 22-200 Włodawa",0619011
szkola,ZESPÓŁ SZKOLNO-PRZEDSZKOLNY W ŚNIADOWIE,"Łomżyńska 29, 18-411 Śniadowo",2007072
szkola,ZESPÓŁ SZKÓŁ W GÓROWIE IŁAWECKIM,"Kardynała Wyszyńskiego 1, 11-220 Górowo Iławeckie",2801021
szkola,ZESPÓŁ SZKÓŁ NR 4 WE WŁOCŁAWKU,"Kaliska 108A, 87-800 Włocławek",0464011
szkola,ZESPÓŁ SZKÓŁ EKONOMICZNYCH W RADOMIU,"Stanisława Wernera 22, 26-600 Radom",1463011
szkola,ZESPÓŁ SZKÓŁ PONADPODSTAWOWYCH NR 2 IM. ELIZY ORZESZKOWEJ W BARTOSZYCACH,"Słowackiego 1, 11-200 Bartoszyce",2801011
szkola,GMINNY ZESPÓŁ SZKÓŁ W KAZIMIERZU DOLNYM,"Szkolna 1, 24-120 Kazimierz Dolny",0614044
szkola,CENTRUM OŚWIATOWO-KULTURALNE W POTARZYCY IM. JANA HEWELIUSZA W POTARZYCY,"Wyzwolenia 65, 63-200 Potarzyca",3006025
szkola,ZESPÓŁ PLACÓWEK OŚWIATOWYCH,"Szkolna 2, 06-460 Grudusk",1402052
szkola,ZESPÓŁ PLACÓWEK OŚWIATOWYCH W SŁUPI,"Słupia 281, 28-350 Słupia",2602072
szkola,ZESPÓŁ SZKOLNO - PRZEDSZKOLNY W POTĘPIE,"Tarnogórska 12, 42-693 Potępa",2413052
szkola,ZESPÓŁ SZKOŁY PODSTAWOWEJ I PRZEDSZKOLA W OTFINOWIE,"Otfinów 58, 33-250 Otfinów",1216155
szkola,ZESPÓŁ SZKOLNO - PRZEDSZKOLNY W ŚWIĘTNIE,"Szkolna 3, 64-224 Świętno",3029035
szkola,ZESPÓŁ SZKÓŁ W WIDAWIE,"Wieluńska 17, 98-170 Widawa",1003042
szkola,ZESPÓŁ SZKÓŁ W STANINIE,"Stanin 149, 21-422 Stanin",0611072
szkola,ZESPÓŁ EDUKACYJNY W BOJADŁACH,"Szkolna 1, 66-130 Bojadła",0809022
szkola,ZESPÓŁ PLACÓWEK OŚWIATOWYCH W STRZELINIE,"Ząbkowicka 30, 57-100 Strzelin",0217044
szkola,ZESPÓŁ SZKÓŁ PUBLICZNYCH NR 2 W KOBYŁCE,"Elizy Orzeszkowej 3/5, 05-230 Kobyłka",1434011
szkola,CENTRUM KSZTAŁCENIA USTAWICZNEGO W ZIELONEJ GÓRZE,"Stanisława Staszica 2, 65-175 Zielona Góra",0862011
szkola,ZESPÓŁ SZKÓŁ NR 1 IM. K. K. BACZYŃSKIEGO,"Skłodowskiej-Curie 24, 08-300 Sokołów Podlaski",1429011
szkola,ZESPÓŁ SZKÓŁ NR 33 SPECJALNYCH DLA DZIECI I MŁODZIEŻY PRZEWLEKLE CHOREJ,"Marii Curie-Skłodowskiej 4, 85-094 Bydgoszcz",0461011
szkola,ZESPÓŁ SZKÓŁ W PSTRĄGOWEJ,"Pstrągowa 105, 38-121 Pstrągowa",1819012
szkola,ZESPÓŁ SZKÓŁ OGÓLNOKSZTAŁCĄCYCH NR 2 W KWIDZYNIE,"Słoneczna 2, 82-500 Kwidzyn",2207011
szkola,ZESPÓŁ PLACÓWEK EDUKACYJNYCH,"Edwarda Turowskiego 1, 10-685 Olsztyn",2862011
szkola,ZESPÓŁ SZKÓŁ W WYŻNEM,"Wyżne 40, 38-120 Wyżne",1819012
szkola,ZESPÓŁ SZKÓŁ IM. JANA PAWŁA II W BABICY,"Babica 102, 38-120 Babica",1819012
szkola,ZESPÓŁ SZKÓŁ W DZWOLI,"Dzwola 121b, 23-304 Dzwola",0605032
szkola,ZESPÓŁ SZKÓŁ W KOCUDZY,"Kocudza Pierwsza 29, 23-304 Kocudza Pierwsza",0605032
szkola,ZESPÓŁ SZKÓŁ W KRZEMIENIU,"Krzemień Pierwszy 192, 23-304 Krzemień Pierwszy",0605032
szkola,ZESPÓŁ SZKÓŁ IM. WŁADYSŁAWA PODKOWIŃSKIEGO W MOKREJ WSI,"Marii Konopnickiej 12, 05-240 Mokra Wieś",1434115
szkola,ZESPÓŁ SZKÓŁ IM. ZOFII SOLARZOWEJ W MIĄSEM,"Kardynała Wyszyńskiego 44, 05-240 Miąse",1434115
szkola,ZESPÓŁ SZKÓŁ W JASIENICY,"Szkolna 8, 05-240 Jasienica",1434115
szkola,ZESPÓŁ SZKOŁ W KOZŁACH,"Niepodległości 50, 05-240 Kozły",1434115
szkola,ZESPÓŁ SZKOŁY PODSTAWOWEJ I PRZEDSZKOLA W CHOBIENICACH,"Chobienice 145, 64-214 Chobienice",3029022
szkola,ZESPÓŁ SZKOŁY PODSTAWOWEJ I PRZEDSZKOLI W KOPANICY,"Szkolna 2, 64-225 Kopanica",3029022
szkola,ZESPÓŁ SZKOŁY PODSTAWOWEJ I PRZEDSZKOLA W BELĘCINIE,"Belęcin 76, 64-231 Belęcin",3029022
szkola,ZESPÓŁ SZKÓŁ W DZIETRZKOWICACH,"Szkolna 1, 98-432 Dzietrzkowice",1018052
szkola,ZESPÓŁ SZKÓŁ IM. ARMII GEN. ANDERSA W ŁUBNICACH,"Leśna 1, 98-432 Łubnice",1018052
szkola,ZESPÓŁ SZKÓŁ W WÓJCINIE,"Wieluńska 9, 98-432 Wójcin",1018052
szkola,ZESPÓŁ SZKÓŁ GMINY KOŚCIAN PRZEDSZKOLE I SZKOŁA PODSTAWOWA W BONIKOWIE,"Parkowa 3, 64-000 Bonikowo",3011032
szkola,ZESPÓŁ SZKÓŁ IM. JADWIGI I WŁADYSŁAWA ZAMOYSKICH W ROKIETNICY,"Szamotulska 24, 62-090 Rokietnica",3021132
szkola,ZESPÓŁ SZKÓŁ SPECJALNYCH DLA DZIECI I MŁODZIEŻY PRZEWLEKLE CHORYCH I NIEPEŁNOSPRAWNYCH NR 1,"Stanisława Staszica 7, 87-720 Ciechocinek",0401021
szkola,ZESPÓŁ SZKÓŁ TECHNICZNYCH,"Jana Kilińskiego 4, 09-402 Płock",1462011
szkola,ZESPÓŁ SZKÓŁ IM. INTEGRACJI EUROPEJSKIEJ W NOWYM MIEŚCIE,"Ciechanowska 15, 09-120 Nowe Miasto",1420084
szkola,ZESPÓŁ SZKÓŁ PUBLICZNYCH IM. JANA PAWŁA II,"Szkolna 8, 57-350 Kudowa-Zdrój",0208031
szkola,ZESPÓŁ SZKOLNO- PRZEDSZKOLNY W GRĘBKOWIE,"Szkolna 1, 07-110 Grębków",1433022
szkola,ZESPÓŁ SZKÓŁ POWIATOWYCH W ŁYSYCH,"Stanisława Krupki 20, 07-437 Łyse",1415072
szkola,ZESPÓŁ SZKOLNO-PRZEDSZKOLNY NR 3 W ROGOWIE OPOLSKIM,"Bolesława Chrobrego 15, 47-300 Rogów Opolski",1605025
szkola,ZESPÓŁ SZKOLNO-PRZEDSZKOLNY W MSZANCE,"Mszanka 31, 38-322 Mszanka",1205062
szkola,ZESPÓŁ SZKÓŁ W WODZISŁAWIU,"Szkolna 4, 28-330 Wodzisław",2602094
szkola,ZESPÓŁ SZKÓŁ W SĘDZISZOWIE,"Przemysłowa 8, 28-340 Sędziszów",2602064
szkola,ZESPÓŁ SZKÓŁ NR 2 IM. GEN. STEFANA ROWECKIEGO „GROTA” W JĘDRZEJOWIE,"Okrzei 63, 28-300 Jędrzejów",2602024
szkola,ZESPÓŁ SZKÓŁ CENTRUM KSZTAŁCENIA ROLNICZEGO IM. MACIEJA RATAJA W KRZELOWIE,"Krzelów 39, 28-340 Krzelów",2602065
szkola,ZESPÓŁ SZKÓŁ INTEGRACYJNYCH W SAMOKLĘSKACH,"Samoklęski 206, 38-223 Samoklęski",1805082
szkola,ZESPÓŁ SZKÓŁ PONADPODSTAWOWYCH NR 1 IM. KRESOWIAKÓW W BARTOSZYCACH,"Limanowskiego 10, 11-200 Bartoszyce",2801011
szkola,ZESPÓŁ SZKÓŁ MEDYCZNYCH W KĘDZIERZYNIE - KOŹLU,"Piastowska 12, 47-200 Kędzierzyn-Koźle",1603011
szkola,ZESPÓŁ SZKÓŁ MEDYCZNYCH IM. JANUSZA KORCZAKA W PRUDNIKU,"Piastowska 26, 48-200 Prudnik",1610044
szkola,ZESPÓŁ SZKÓŁ BUDOWLANYCH IM. KAZIMIERZA WIELKIEGO W RADOMIU,"Tadeusza Kościuszki 7, 26-600 Radom",1463011
szkola,ZESPÓŁ SZKÓŁ PUBLICZNYCH W POSADZIE GÓRNEJ,"3 Maja 164, 38-481 Posada Górna",1807085
szkola,ZESPÓŁ PLACÓWEK OŚWIATOWYCH W MIŁKACH,"Szkolna 3, 11-513 Miłki",2806062
szkola,ZESPÓŁ SZKÓŁ W KOZIEGŁOWACH,"3 Maja 12, 42-350 Koziegłowy",2409024
szkola,ZESPÓŁ SZKÓŁ TECHNICZNYCH IM. FLORIANA CEYNOWY W KARTUZACH,"Mściwoja II 24, 83-300 Kartuzy",2205024
szkola,ZESPÓŁ SZKOŁA PODSTAWOWA IM. JULIANA TUWIMA I PRZEDSZKOLE W KOBYLINIE,"3 Maja 9, 63-740 Kobylin",3012024
szkola,ZESPÓŁ PLACÓWEK NR 1 WE WŁOCŁAWKU,"Mechaników 1, 87-800 Włocławek",0464011
szkola,ZESPÓŁ SZKÓŁ NR 11,"Papieżka 89, 87-800 Włocławek",0464011
szkola,ZESPÓŁ SZKÓŁ EKONOMICZNYCH,"Bukowa 38/40, 87-800 Włocławek",0464011
szkola,ZESPÓŁ SZKÓŁ CHEMICZNYCH IM. MARII SKŁODOWSKIEJ-CURIE,"Bulwary Marszałka Józefa Piłsudskiego 4, 87-800 Włocławek",0464011
szkola,ZESPÓŁ SZKÓŁ NR 3 IM. MARII GRZEGORZEWSKIEJ,"Nowomiejska 21, 87-800 Włocławek",0464011
szkola,ZESPÓŁ SZKÓŁ TECHNICZNYCH W SUWAŁKACH,"Sejneńska 33, 16-400 Suwałki",2063011
szkola,ZESPÓŁ SZKÓŁ W JERZMANOWICACH,"Szkolna 2, 32-048 Jerzmanowice",1206042
szkola,ZESPÓŁ PORADNI PSYCHOLOGICZNO-PEDAGOGICZNYCH NR 1 W POZNANIU,"Juliusza Słowackiego 54, 60-521 Poznań-Jeżyce",3064039
szkola,ZESPÓŁ SZKÓŁ W PRZEGINI,"Przeginia 403, 32-049 Przeginia",1206042
szkola,"ZESPÓŁ SZKOŁY PODSTAWOWEJ IM.SIERŻ. AK JÓZEFA SIWAKA""WALIGÓRY"" I PRZEDSZKOLA W BUCHCICACH","Buchcice 41, 33-170 Buchcice",1216105
szkola,ZESPÓŁ SZKÓŁ W MICHAŁOWIE,"Sienkiewicza 5, 16-050 Michałowo",2002074
szkola,ZESPÓŁ SZKÓŁ MECHANICZNYCH IM. STEFANA CZARNIECKIEGO W ŁAPACH,"gen. Władysława Sikorskiego 68, 18-100 Łapy",2002064
szkola,ZESPÓŁ SZKÓŁ ZAWODOWYCH IM.GEN.JÓZEFA BEMA,"Szpitalna 9, 11-600 Węgorzewo",2819034
szkola,ZESPÓŁ PLACÓWEK SPECJALNYCH PRZY ZAKŁADACH OPIEKI ZDROWOTNEJ W OPOLU,"Aleja Wincentego Witosa 26, 45-401 Opole",1661011
szkola,ZESPÓŁ SZKÓŁ NR 2 IM. HETMANA STEFANA CZARNIECKIEGO WE WŁOSZCZOWIE,"Koniecpolska 40, 29-100 Włoszczowa",2613064
szkola,ZESPÓŁ SZKÓŁ NR 3 IM. STANISŁAWA STASZICA WE WŁOSZCZOWIE,"Wiśniowa 23, 29-100 Włoszczowa",2613064
szkola,ZESPÓŁ SZKÓŁ ELEKTRYCZNO-MECHANICZNYCH W LEGNICY,"Fryderyka Skarbka 4, 59-220 Legnica",0262011
szkola,ZESPÓŁ SZKÓŁ OGÓLNOKSZTAŁCACYCH W WĄBRZEŹNIE,"Wolności 35, 87-200 Wąbrzeźno",0417011
szkola,ZESPÓŁ SZKÓŁ EKONOMICZNYCH IM.KS.JANUSZA ST.PASIERBA W TCZEWIE,"Gdańska 17, 83-110 Tczew",2214011
szkola,"ZESPÓŁ SZKOLNO-PRZEDSZKOLNY W ROŻNOWICACH, SZKOŁA PODSTAWOWA IM. TADEUSZA KOŚCIUSZKI I PRZEDSZKOLE","Rożnowice 325, 38-323 Rożnowice",1205025
szkola,ZESPÓŁ SZKÓŁ SPECJALNYCH W CZELADZI,"Szpitalna 85, 41-250 Czeladź",2401021
szkola,SPOŁECZNY ZESPÓŁ SZKOLNO-PRZEDSZKOLNY W KUDOWIE-ZDROJU,"Słone 72, 57-350 Kudowa-Zdrój",0208031
szkola,ZESPÓŁ SZKÓŁ W DĄBROWICACH,"Kłodawska 1, 99-352 Dąbrowice",1002034
szkola,ZESPÓŁ SZKÓŁ NR 1 IM. STANISŁAWA STASZICA W KWIDZYNIE,"Słowiańska 17, 82-500 Kwidzyn",2207011
szkola,ZESPÓŁ SZKOLNO-PRZEDSZKOLNY W LUBOCHNI,"Łódzka 19, 97-217 Lubochnia",1016062
szkola,ZESPÓŁ SZKÓŁ PLASTYCZNYCH IM. JÓZEFA BRANDTA W RADOMIU,"Józefa Grzecznarowskiego 13, 26-600 Radom",1463011
szkola,ZESPÓŁ SZKÓŁ SPECJALNYCH PRZY DOMU POMOCY SPOŁECZNEJ W KADŁUBIE,"Zamkowa 5, 47-175 Kadłub",1611055
szkola,ZESPÓŁ SZKÓŁ SPECJALNYCH IM. JANA PAWŁA II,"Piłsudskiego 4, 08-300 Sokołów Podlaski",1429011
szkola,ZESPÓŁ SZKOLNO-PRZEDSZKOLNY W STRZEGOMIU,"Wacława Dąbrówki 3, 28-221 Strzegomek",2612062
szkola,ZESPÓŁ SZKOLNO-PRZEDSZKOLNY W KÓRNICY,"Główna 2, 47-300 Kórnica",1605025
szkola,ZESPÓŁ SZKÓŁ IM. EMILII SCZANIECKIEJ W PNIEWACH,"Wolności 10, 62-045 Pniewy",3024064
szkola,ZESPÓŁ SZKÓŁ SPECJALNYCH NR 110 DLA DZIECI PRZEWLEKLE CHORYCH PRZY SZPITALU KLINICZNYM IM. KAROLA JONSCHERA UNIWERSYTETU MEDYCZNEGO W POZNANIU,"Szpitalna 27/33, 60-572 Poznań-Jeżyce",3064039
szkola,ZESPÓŁ SZKÓŁ NR 1 W SANOKU IM. KAROLA ADAMIECKIEGO,"Jana III Sobieskiego 23, 38-500 Sanok",1817011
szkola,ZESPÓŁ KSZTAŁCENIA I WYCHOWANIA NR 1 W PELPLINIE,"Sambora 5a, 83-130 Pelplin",2214044
szkola,ZESPÓŁ KSZTAŁCENIA I WYCHOWANIA W RAJKOWACH,"Jesionowa 6, 83-130 Rajkowy",2214045
szkola,ZESPÓŁ KSZTAŁCENIA I WYCHOWANIA W KULICACH,"Szkolna 1, 83-130 Kulice",2214045
szkola,ZESPÓŁ KSZTAŁCENIA I WYCHOWANIA W RUDNIE,"Szkolna 4, 83-121 Rudno",2214045
szkola,ZESPÓŁ SZKÓŁ W ZEMBRZYCACH,"Zembrzyce 490, 34-210 Zembrzyce",1215092
szkola,ZESPÓŁ SZKÓŁ PUBLICZNYCH W BAĆKOWICACH,"Baćkowice 100, 27-552 Baćkowice",2606012
szkola,ZESPÓŁ SZKOLNO-PRZEDSZKOLNY ŚWINOUJŚCIU,"Sąsiedzka 13a, 72-605 Świnoujście",3263011
szkola,CENTRUM EDUKACJI ZAWODOWEJ I TURYSTYKI W ŚWINOUJŚCIU,"Gdyńska 26, 72-600 Świnoujście",3263011
szkola,ZESPÓŁ SZKÓŁ MORSKICH IM. EUGENIUSZA KWIATKOWSKIEGO W ŚWINOUJŚCIU,"Jana Sołtana 2, 72-602 Świnoujście",3263011
szkola,ZESPÓŁ SZKÓŁ WOJEWÓDZKIEGO ZAKŁADU DOSKONALENIA ZAWODOWEGO W SZCZECINIE Z SIEDZIBĄ W ŚWINOUJŚCIU,"Norweska 12a, 72-602 Świnoujście",3263011
szkola,ZESPÓŁ SZKOLNO- PRZEDSZKOLNY IM. JANA PAWŁA II W RYTWIANACH,"Szkolna 9, 28-236 Rytwiany",2612062
szkola,ZESPÓŁ SZKOLNO-PRZEDSZKOLNY W KSIĄŻU WIELKIM,"Mikołaja Reja 4, 32-210 Książ Wielki",1208044
szkola,ZESPÓŁ PLACÓWEK OŚWIATOWYCH W JASIENICY,"Jasienica 48, 32-400 Jasienica",1209035
szkola,ZESPÓŁ SZKÓŁ TECHNICZNYCH IM. GEN. PROF. SYLWESTRA KALISKIEGO W TURKU,"Wincentego Milewskiego 3b, 62-700 Turek",3027011
szkola,ZESPÓŁ SZKÓŁ OGÓLNOKSZTAŁCĄCYCH W ZAWIERCIU,"Wojska Polskiego 55, 42-400 Zawiercie",2416021
szkola,ZESPÓŁ SZKÓŁ W RADOMYŚLU NAD SANEM,"Legionów 22, 37-455 Radomyśl nad Sanem",1818042
szkola,ZESPÓŁ SZKOLNO - PRZEDSZKOLNY W ŻARNOWCU,"Żarnowiec 137, 38-460 Żarnowiec",1807045
szkola,ZESPÓŁ SZKOLNO - PRZEDSZKOLNY W JASZCZWI,"Jaszczew 333, 38-460 Jaszczew",1807045
szkola,ZESPÓŁ SZKOŁY PODSTAWOWEJ I PRZEDSZKOLA W ILKOWICACH,"Rudno 195, 33-131 Ilkowice",1216155
szkola,PUBLICZNY KATOLICKI ZESPÓŁ SZKÓŁ I PRZEDSZKOLA W NIECIECZY,"Nieciecza 175, 33-240 Nieciecza",1216155
szkola,ZESPÓŁ SZKÓŁ SAMOCHODOWYCH IM. TADEUSZA KOŚCIUSZKI,"Leśna 1A, 87-800 Włocławek",0464011
szkola,ZESPÓŁ SZKÓŁ ROLNICZYCH W KIJANACH,"Kijany 19, 21-077 Kijany",0610062
szkola,ZESPÓŁ SZKÓŁ NR 2 IM. SIMONA BOLIVARA W MILEJOWIE,"Partyzancka 62, 21-020 Milejów-Osada",0610042
szkola,ZESPÓŁ SZKÓŁ IM. KRÓLA KAZIMIERZA JAGIELLOŃCZYKA W ŁĘCZNEJ,"Bogdanowicza 9, 21-010 Łęczna",0610034
szkola,ZESPÓŁ SZKÓŁ W LUDWINIE,"Ludwin 30a, 21-075 Ludwin",0610022
szkola,SIERADZKI ZESPÓŁ SZKÓŁ SPOŁECZNEGO TOWARZYSTWA OŚWIATOWEGO W SIERADZU,"Bohaterów Września 61, 98-200 Sieradz",1014011
szkola,ZESPÓŁ SZKÓŁ IM. CELESTYNA KAMIŃSKIEGO W DĄBROWIE CHEŁMIŃSKIEJ,"Sportowa 1, 86-070 Dąbrowa Chełmińska",0403022
szkola,ZESPÓŁ SZKÓŁ IMIENIA MARIANA REJEWSKIEGO W OSTROMECKU,"Szkolna 1, 86-070 Ostromecko",0403022
szkola,ZESPÓŁ SZKÓŁ W CZARŻU,"Chełmińska 47, 86-070 Czarże",0403022
szkola,ZESPÓŁ PLACÓWEK OŚWIATOWYCH IM. OBROŃCÓW WARSZAWY W OSIECZANACH,"Osieczany 100, 32-400 Osieczany",1209035
szkola,ZESPÓŁ SZKÓŁ W JASIENICY ROSIELNEJ,"Jasienica Rosielna 223, 36-220 Jasienica Rosielna",1802052
szkola,ZESPÓŁ SZKOLNO-PRZEDSZKOLNY W DOBRZYNIEWIE DUŻYM,"Szkolna 14, 16-002 Dobrzyniewo Duże",2002032
szkola,ZESPÓŁ SZKOLNO-PRZEDSZKOLNY W FASTACH,"Białostocka 5, 15-694 Fasty",2002032
szkola,ZESPÓŁ SZKOLNO-PRZEDSZKOLNY W NOWYM ALEKSANDROWIE,"Pogodna 107, 16-002 Nowe Aleksandrowo",2002032
szkola,ZESPÓŁ SZKÓŁ ZAWODOWYCH PRZEDSIĘBIORSTWA BUDOWNICTWA OGÓLNEGO SP. Z O.O.,"Botaniczna 77, 65-392 Zielona Góra",0862011
szkola,ZESPÓŁ SZKÓŁ SAMORZĄDOWYCH W PRYMUSOWEJ WOLI,"Prymusowa Wola 6, 26-332 Prymusowa Wola",1007072
szkola,ZESPÓŁ SZKÓŁ IM. ADAMA MICKIEWICZA W OBJEZIERZU,"Objezierze 3, 64-600 Objezierze",3016015
szkola,ZESPÓŁ SZKOLNO - PRZEDSZKOLNY IM. JANA PAWŁA II W RUDNIKACH,"Szkolna 11, 42-240 Rudniki",2404152
szkola,ZESPÓŁ SZKOLNO-PRZEDSZKOLNY W WAPLEWIE,"Waplewo 15, 11-015 Waplewo",2814095
szkola,ZESPÓŁ SZKOLNO-PRZEDSZKOLNY NR 3 W KĘTACH,"Szkolna 3, 32-650 Kęty",1213044
szkola,ZESPÓŁ SZKÓŁ PONADPODSTAWOWYCH NR 2 W JAWORZNIE,"Inwalidów Wojennych 16, 43-603 Jaworzno",2468011
szkola,ZESPÓŁ SZKÓŁ PONADPODSTAWOWYCH W WOLINIE,"Słowiańska 2, 72-510 Wolin",3207064
szkola,ZESPÓŁ SZKÓŁ PONADPODSTAWOWYCH IM. IGNACEGO WYSSOGOTY ZAKRZEWSKIEGO W ŻELECHOWIE,"Marszałka Józefa Piłsudskiego 45, 08-430 Żelechów",1403144
szkola,ZESPÓŁ SZKÓŁ IM. WINCENTEGO WITOSA W JASIEŃCU,"Czerska 1, 05-604 Jasieniec",1406062
szkola,"ZESPÓŁ SZKÓŁ IM. ARMII KRAJOWEJ OBWODU ""GŁUSZEC""- GRÓJEC W GRÓJCU","Księdza Piotra Skargi 12, 05-600 Grójec",1406054
szkola,ZESPÓŁ SZKÓŁ PONADPODSTAWOWYCH W BENICACH,"Benice 12a, 72-400 Benice",3207035
szkola,ZESPÓŁ PLACÓWEK EDUKACYJNO - WYCHOWAWCZYCH,"Parkowa 9, 59-600 Lwówek Śląski",0212034
szkola,ZESPÓŁ SZKÓŁ EKONOMICZNO TECHNICZNYCHIM. KOMBATANTÓW ZIEMII LWÓWECKIEJ,"Rakowice Wielkie 48, 59-600 Rakowice Wielkie",0212035
szkola,ZESPÓŁ SZKÓŁ OGÓLNOKSZTAŁCĄCYCH I ZAWODOWYCH IM. JANA PAWŁA II W GRYFOWIE ŚLĄSKIM,"Kolejowa 16, 59-620 Gryfów Śląski",0212014
szkola,ZESPÓŁ SZKÓŁ IM. STANISŁAWA STASZICA W MIĘTNEM,"Główna 49, 08-400 Miętne",1403042
szkola,ZESPÓŁ SZKÓŁ W SĘDZISZOWIE MAŁOPOLSKIM SZKOŁA PODSTAWOWA NR 4 IM.WŁADYSŁAWA BRONIEWSKIEGO I PUBLICZNE PRZEDSZKOLE NR 4,"Legionów Polskich 162, 39-120 Sędziszów Małopolski",1815044
szkola,ZESPÓŁ SZKÓŁ SPECJALNYCH IM. KS. JANA TWARDOWSKIEGO W GRÓJCU,"Polna 17, 05-600 Grójec",1406054
szkola,ZESPÓŁ SZKÓŁ TECHNICZNYCH IM. HIPOLITA CEGIELSKIEGO W ŚREMIE,"Stanisława Staszica 3, 63-100 Śrem",3026044
szkola,ZESPÓŁ SZKOLNO-PRZEDSZKOLNY W MĘCINCE,"Męcinka 10B, 59-424 Męcinka",0205032
szkola,ZESPÓŁ SZKÓŁ PONADPODSTAWOWYCH NR 1 W PIOTRKOWIE TRYBUNALSKIM,"Franklina Roosevelta 1, 97-300 Piotrków Trybunalski",1062011
szkola,ZESPÓŁ SZKÓŁ PONADPODSTAWOWYCH NR 2 W PIOTRKOWIE TRYBUNALSKIM,"Romana Dmowskiego 38e, 97-300 Piotrków Trybunalski",1062011
szkola,ZESPÓŁ SZKÓŁ PONADPODSTAWOWYCH I PLACÓWEK OPIEKUŃCZO-WYCHOWAWCZYCH NR 3 IM. WŁADYSŁAWA REYMONTA W PIOTRKOWIE TRYBUNALSKIM,"Władysława Broniewskiego 16, 97-300 Piotrków Trybunalski",1062011
szkola,ZESPÓŁ SZKÓŁ PONADPODSTAWOWYCH NR 4 IM. KS. JERZEGO POPIEŁUSZKI W PIOTRKOWIE TRYBUNALSKIM,"Henryka Sienkiewicza 10/12, 97-300 Piotrków Trybunalski",1062011
szkola,ZESPÓŁ SZKÓŁ PONADPODSTAWOWYCH NR 5 W PIOTRKOWIE TRYBUNALSKIM,"Leonarda 12/14, 97-300 Piotrków Trybunalski",1062011
szkola,ZESPÓŁ SZKOLNO-PRZEDSZKOLNY W RZGOWIE,"Plac Stuczyńskich 5, 62-586 Rzgów",3010082
szkola,ZESPÓŁ PLACÓWEK OŚWIATOWYCH W SYPNIEWIE,"Władysława Broniewskiego 2A, 06-216 Sypniewo",1411092
szkola,ZESPÓŁ SZKOLNO-PRZEDSZKOLNY W CZARNOLESIE,"Czarnolas 87, 26-720 Czarnolas",1436022
szkola,ZESPÓŁ PLACÓWEK OŚWIATOWYCH POLICZNA,"Stefana Żeromskiego 44, 26-720 Policzna",1436022
szkola,ZESPÓŁ SZKÓŁ NR 2 IM. MARSZAŁKA JÓZEFA PIŁSUDSKIEGO W BRZEŚCIU KUJAWSKIM,"Konarskiego 63, 87-880 Brześć Kujawski",0418044
szkola,ZESPÓŁ SZKOLNO-PRZEDSZKOLNY W ZABORZU,"Miarki 7, 43-520 Zaborze",2403052
szkola,ZESPÓŁ SZKÓŁ ZAWODOWYCH I LICEALNYCH W ZGORZELCU,"Powstańców Śląskich 1, 59-900 Zgorzelec",0225021
szkola,ZESPÓŁ SZKÓŁ W CZAPLINKU,"Grunwaldzka 1, 78-550 Czaplinek",3203014
szkola,ZESPÓŁ SZKOLNO-WYCHOWAWCZY W HUSZLEWIE,"Huszlew 113, 08-206 Huszlew",1410012
szkola,ZESPÓŁ SZKÓŁ SAMORZĄDOWYCH NR1 IM.MARII SKŁODOWSKIEJ - CURIE W OPOCZNIE,"Marii Curie-Skłodowskiej 5, 26-300 Opoczno",1007044
szkola,ZESPÓŁ SZKÓŁ W KAMIONCE IM.KS.KARDYNAŁA STEFANA WYSZYŃSKIEGO,"Lubartowska 53, 21-132 Kamionka",0608054
szkola,ZESPÓŁ SZKOLNO-PRZEDSZKOLNY W BYDLINIE,"Legionów 32, 32-310 Bydlin",1212042
szkola,ZESPÓŁ SZKÓŁ ZAWODOWYCH IM. PIASTÓW OPOLSKICH W KRAPKOWICACH,"Zamkowa 5, 47-300 Krapkowice",1605024
szkola,ZESPÓŁ SZKÓŁ W JERCE,"Szkolna 5, 64-010 Jerka",3011045
szkola,NIEPUBLICZNY ZESPÓŁ SZKÓŁ W ROPCZYCACH,"Konopnickiej 2, 39-100 Ropczyce",1815034
szkola,ZESPÓŁ PLACÓWEK OŚWIATOWYCH W JURKOWIE,"Jurków 115, 34-643 Jurków",1207032
szkola,ZESPÓŁ PLACÓWEK OŚWIATOWYCH W SKRZYDLNEJ,"Skrzydlna 186, 34-625 Skrzydlna",1207032
szkola,ZESPÓŁ SZKÓŁ W RUDKACH,"Szkolna 2, 26-006 Rudki",2604135
szkola,"ZESPÓŁ SZKÓŁ ZAWODOWYCH IM. MJR HENRYKA DOBRZAŃSKIEGO ""HUBALA"" W RADOMIU","Aleja Józefa Grzecznarowskiego 2, 26-600 Radom",1463011
szkola,ZESPÓŁ SZKOLNO-PRZEDSZKOLNY W CHECHLE,"Kluczewska 56, 32-310 Chechło",1212042
szkola,ZESPÓŁ SZKOLNO-PRZEDSZKOLNY W KWAŚNIOWIE DOLNYM,"Basztowa 2, 32-310 Kwaśniów Dolny",1212042
szkola,ZESPÓŁ SZKOLNO-PRZEDSZKOLNY W RYCZÓWKU,"Dolna 12, 32-310 Ryczówek",1212042
szkola,ZESPÓŁ SZKÓŁ IM. JANA PAWŁA II W ZDZIESZOWICACH,"Góry Świętej Anny 21A, 47-330 Zdzieszowice",1605054
szkola,ZESPÓŁ SZKÓŁ SPECJALNYCH IM. JULIANA TUWIMA W KRAPKOWICACH,"Kościelna 10, 47-300 Krapkowice",1605024
szkola,ZESPÓŁ SZKÓŁ SPECJALNYCH W BRAŃSZCZYKU,"Jana Pawła II 30, 07-221 Brańszczyk",1435012
szkola,ZESPÓŁ SZKÓŁ NR 1 IM. MARII SKŁODOWSKIEJ-CURIE W WYSZKOWIE,"Świętojańska 89, 07-200 Wyszków",1435054
szkola,ZESPÓŁ SZKOLNO-PRZEDSZKOLNY IM. MJRA HENRYKA SUCHARSKIEGO W TYLMANOWEJ,"Osiedle Kozielce 296, 34-451 Tylmanowa",1211102
szkola,ZESPÓŁ SZKÓŁ W CIESZYNIE,"Kościelna 34F, 63-435 Cieszyn",3017082
szkola,ZESPÓŁ SZKÓŁ W GRANOWCU,"Odolanowska 19, 63-435 Granowiec",3017082
szkola,ZESPÓŁ SZKÓŁ W SOŚNIACH,"Wielkopolska 43, 63-435 Sośnie",3017082
szkola,ZESPÓŁ SZKÓŁ ELEKTRONICZNYCH IM. BOHATERÓW WESTERPLATTE W RADOMIU,"Sadkowska 19, 26-600 Radom",1463011
szkola,ZESPÓŁ SZKÓŁ IM. STANISŁAWA PIGONIA W MEDYNI ŁAŃCUCKIEJ,"Medynia Łańcucka 105, 37-126 Medynia Łańcucka",1810032
szkola,ZESPÓŁ SZKÓŁ W OTMUCHOWIE,"Krakowska 36, 48-385 Otmuchów",1607064
szkola,ZESPÓŁ SZKÓŁ W JABŁONOWIE POMORSKIM,"Nowy Rynek 5, 87-330 Jabłonowo Pomorskie",0402074
szkola,ZESPÓŁ PLACÓWEK OŚWIATOWYCH - PUBLICZNA SZKOŁA PODSTAWOWA I PRZEDSZKOLE IM. MARII FIRLEJCZYK W SICHOWIE DUŻYM,"Sichów Duży 88, 28-236 Sichów Duży",2612062
szkola,ZESPÓŁ SZKÓŁ W KRZEPICACH,"Ryły 26, 42-160 Krzepice",2406024
szkola,ZESPÓŁ SZKÓŁ IM. ŚW. JANA KANTEGO W ZALESIU,"Zalesie 123, 37-126 Zalesie",1810032
szkola,ZESPÓŁ SZKÓŁ NR 1 IM. SZARYCH SZEREGÓW W ŁASKARZEWIE,"Alejowa 23, 08-450 Łaskarzew",1403021
szkola,ZESPÓŁ SZKÓŁ NR 2 W ŁASKARZEWIE,"Kolejowa 13, 08-450 Łaskarzew",1403021
szkola,ZESPÓŁ SZKÓŁ STOWARZYSZENIA ABSOLWENTÓW SZKÓŁ ROLNICZYCH IM.PROF. DR HAB. TEODORA MARCHLEWSKIEGO W TRZCINICY,"Trzcinica 79, 38-207 Trzcinica",1805042
szkola,ZESPÓŁ SZKÓŁ W CERANOWIE,"Ceranów 206, 08-322 Ceranów",1429032
szkola,ZESPÓŁ SZKOLNO-PRZEDSZKOLNY W WITKOWICACH,"Beskidzka 98, 32-650 Witkowice",1213045
szkola,ZESPÓŁ SZKÓŁ POWIATOWYCH IM. KSIĘDZA ADAMA BARGIELSKIEGO W MYSZYŃCU,"Dzieci Polskich 5, 07-430 Myszyniec",1415084
szkola,ZESPÓŁ SZKÓŁ W DOBRZECHOWIE,"Dobrzechów 197, 38-100 Dobrzechów",1819045
